nomeProduto,categoria
"SUPLEMENTO ALIMENTAR DE CARNITINA, CAFÉ VERDE, LARANJA MORO, VITAMINAS E MINERAIS EM EMULSÃO",Suplementos alimentares
"SUPLEMENTO ALIMENTAR DE CARNITINA, CURCUMA, LARANJA MORO, CAFEÍNA, TEANINA E MINERAIS EM CÁPSULA",Suplementos alimentares
"SUPLEMENTO ALIMENTAR DE CARNITINA, LICOPENO, COENZIMA Q10, DHA E EPA, VITAMINAS E MINERAIS EM CÁPSULA",Suplementos alimentares
"SUPLEMENTO ALIMENTAR DE CARNITINA, TAURINA, COENZIMA Q10, VITAMINAS E MINERAIS EM SOLUÇÃO",Suplementos alimentares
SUPLEMENTO ALIMENTAR DE COENZIMA Q10 E MINERAIS EM CÁPSULA,Suplementos alimentares
SUPLEMENTO ALIMENTAR DE COENZIMA Q10 EM CÁPSULA,Suplementos alimentares
"SUPLEMENTO ALIMENTAR DE COENZIMA Q10, ACETILCISTEÍNA, TRANS-RESVERATROL, INOSITOL, ÁCIDO HIALURÔNICO E VITAMINAS EM CÁPSULA",Suplementos alimentares
"SUPLEMENTO ALIMENTAR DE COENZIMA Q10, CURCUMINA, VITAMINAS E MINERAIS EM CÁPSULA",Suplementos alimentares
"SUPLEMENTO ALIMENTAR DE COENZIMA Q10, FOSFATIDILSERINA, MELATONINA, VITAMINAS E MINERAIS EM CÁPSULAS",Suplementos alimentares
"SUPLEMENTO ALIMENTAR DE COENZIMA Q10, L- TIROSINA, FOSFATIDILSERINA E VITAMINAS E MINERAIS EM CÁPSULA",Suplementos alimentares
"SUPLEMENTO ALIMENTAR DE COENZIMA Q10, L-TIROSINA, FOSFATIDILSERINA, TRIPTOFANO, VITAMINAS E MINERAIS EM CÁPSULA",Suplementos alimentares
"SUPLEMENTO ALIMENTAR DE COENZIMA Q10, METILSULFONILMETANO, VITAMINAS E MINERAIS EM CÁPSULAS.",Suplementos alimentares
"SUPLEMENTO ALIMENTAR DE COENZIMA Q10, SEMENTE DE UVA, MAGNÉSIO E VITAMINA C EM CÁPSULA",Suplementos alimentares
"SUPLEMENTO ALIMENTAR DE COENZIMA Q10, VITAMINAS E MINERAIS EM CÁPSULA",Suplementos alimentares
"SUPLEMENTO ALIMENTAR DE COENZIMA Q10, VITAMINAS E MINERAIS EM CÁPSULAS",Suplementos alimentares
SUPLEMENTO ALIMENTAR DE COLÁGENO E VITAMINAS EM PÓ,Suplementos alimentares
SUPLEMENTO ALIMENTAR DE COLÁGENO HIDROLISADO E CREATINA EM PÓ,Suplementos alimentares
"SUPLEMENTO ALIMENTAR DE COLÁGENO HIDROLISADO, CREATINA, VITAMINA C E AMINOÁCIDOS EM PÓ",Suplementos alimentares
"SUPLEMENTO ALIMENTAR DE COLÁGENO TIPO II NÃO DESNATURADO, CÚRCUMA, FENO GREGO, CAFÉ VERDE, LARANJA MORO, CARNITINA E MINERAIS EM CÁPSULA",Suplementos alimentares
"SUPLEMENTO ALIMENTAR DE COLÁGENO TIPO II NÃO DESNATURADO, ÁCIDO HIALURÔNICO, METILSULFONILMETANO, LICOPENO, L-METIONINA, L-CISTEÍNA, SILÍCIO, VITAMINAS E MINERAIS EM CÁPSULA",Suplementos alimentares
"SUPLEMENTO ALIMENTAR DE COLÁGENO TIPO II NÃO DESNATURDO, CONDROITINA, GLUCOSAMINA, METILSULFONILMETANO, VITAMINAS E MINERAIS EM PÓ",Suplementos alimentares
"SUPLEMENTO ALIMENTAR DE COLÁGENO, CURCUMA, VITAMINAS E MINERAIS EM CÁPSULA",Suplementos alimentares
"SUPLEMENTO ALIMENTAR DE COLÁGENO, L-GLUTAMINA E VITAMINAS EM PÓ",Suplementos alimentares
"SUPLEMENTO ALIMENTAR DE COLÁGENO, VITAMINAS E MINERAIS EM CÁPSULAS",Suplementos alimentares
"SUPLEMENTO ALIMENTAR DE COLÁGENO, ÁCIDO HIALURÔNICO, MSM E MINERAIS EM CÁPSULA",Suplementos alimentares
"SUPLEMENTO ALIMENTAR DE CRANBERRY, PINUS PINASTER, VITAMINAS E MINERAIS EM CÁPSULA",Suplementos alimentares
SUPLEMENTO ALIMENTAR DE CREATINA E COENZIMA Q10 EM PÓ,Suplementos alimentares
"SUPLEMENTO ALIMENTAR DE CREATINA, HIDROXIMETILBUTIRATO E FENO GREGO EM PÓ",Suplementos alimentares
"SUPLEMENTO ALIMENTAR DE CREATINA, L-TEANINA E VITAMINA B6 EM PÓ",Suplementos alimentares
"SUPLEMENTO ALIMENTAR DE CREATINA, MAGNÉSIO E INOSITOL EM PÓ",Suplementos alimentares
"SUPLEMENTO ALIMENTAR DE CREATINA, PEPTÍDEOS BIOATIVOS DE COLÁGENO E VITAMINA C EM PÓ",Suplementos alimentares
"SUPLEMENTO ALIMENTAR DE CREATINA, VITAMINAS E MINERAIS EM PÓ",Suplementos alimentares
SUPLEMENTO ALIMENTAR DE CROMO EM CÁPSULA,Suplementos alimentares
SUPLEMENTO ALIMENTAR DE CURCUMA E VITAMINAS EM CÁPSULA,Suplementos alimentares
SUPLEMENTO ALIMENTAR DE CURCUMA EM CÁPSULAS,Suplementos alimentares
"SUPLEMENTO ALIMENTAR DE CURCUMA, CAFÉ VREDE, CARNITINA, TRANS-RESVERATROL, VITAMINAS E MINERAIS EM PÓ",Suplementos alimentares
"SUPLEMENTO ALIMENTAR DE CURCUMA, COLINA, N-ACETIL L-CISTEÍNA E COENZIMA Q10 EM CÁPSULA",Suplementos alimentares
"SUPLEMENTO ALIMENTAR DE CURCUMA, CROMO, CAFÉ VERDE, L-TEANINA EM CÁPSULA",Suplementos alimentares
"SUPLEMENTO ALIMENTAR DE CURCUMA, EXTRATO DE CASCA DE PINHO MARÍTIMO, ZEAXANTINA, VITAMINA C E MINERAIS EM EMULSÃO",Suplementos alimentares
"SUPLEMENTO ALIMENTAR DE CURCUMA, GLUTAMINA E VITAMINAS EM CÁPSULA",Suplementos alimentares
"SUPLEMENTO ALIMENTAR DE CURCUMA, TRANS-RESVERATROL, TRIPTOFANO E VITAMINAS EM SOLUÇÃO.",Suplementos alimentares
"SUPLEMENTO ALIMENTAR DE CÚRCUMA, CARNITINA, CROMO, CAFÉ VERDE, LARANJA MORO, TEANINA EM CÁPSULA",Suplementos alimentares
"SUPLEMENTO ALIMENTAR DE CÚRCUMA, COENZIMA Q10 E MINERAIS EM CÁPSULA",Suplementos alimentares
"SUPLEMENTO ALIMENTAR DE CÚRCUMA, COLÁGENO, VITAMINAS E MINERAIS EM EMULSÃO",Suplementos alimentares
"SUPLEMENTO ALIMENTAR DE DHA E EPA, L-TEANINA, PRÓPOLIS, TRIPTOFANO, VITAMINAS E MINERAIS EM CÁPSULA",Suplementos alimentares
"SUPLEMENTO ALIMENTAR DE DHA, VITAMINAS E MINERAIS EM CÁPSULA",Suplementos alimentares
SUPLEMENTO ALIMENTAR DE DIMAGNÉSIO MALATO EM CÁPSULA,Suplementos alimentares
"SUPLEMENTO ALIMENTAR DE EXTRATO SECO DE SEMENTE DE UVA, VITAMINA E, COENZIMA Q10 E MINERAIS EM SOLUÇÃO",Suplementos alimentares
"SUPLEMENTO ALIMENTAR DE FENO GREGO, ARGININA, ÁCIDO L-ASPÁRTICO, TAURINA, BORO, VITAMINAS E MINERAIS EM CÁPSULA",Suplementos alimentares
"SUPLEMENTO ALIMENTAR DE FENO GREGO, ASPARTATO, BORO, TAURINA, ARGININA, VITAMINAS E MINERAIS EM CÁPSULA",Suplementos alimentares
"SUPLEMENTO ALIMENTAR DE FENO GREGO, BORO, TEANINA, VITAMINAS E MINERAIS EM CÁPSULA",Suplementos alimentares
"SUPLEMENTO ALIMENTAR DE FENO GREGO, CAFEÍNA, ARGININA, ÁCIDO L-ASPÁRTICO, TAURINA, BORO, VITAMINAS E MINERAIS EM CÁPSULA",Suplementos alimentares
"SUPLEMENTO ALIMENTAR DE FENO GREGO, CAFÉ VERDE, VITAMINAS E MINERAIS EM CÁPSULA",Suplementos alimentares
"SUPLEMENTO ALIMENTAR DE FENO GREGO, CARNITINA, CURCUMA, LARANJA MORO, CAFEÍNA, TEANINA, VITAMINAS E MINERAIS EM CÁPSULA",Suplementos alimentares
"SUPLEMENTO ALIMENTAR DE FENO GREGO, GLUTAMINA, CRANBERRY E MINERAIS EM CÁPSULA",Suplementos alimentares
"SUPLEMENTO ALIMENTAR DE FENO GREGO, LARANJA MORO, CAFEÍNA, TAURINA, TEANINA E MINERAIS EM CÁPSULA",Suplementos alimentares
"SUPLEMENTO ALIMENTAR DE FENO GREGO, LARANJA MORO, CAFÉ VERDE, TRIPTOFANO, CURCUMA, VITAMINAS E MINERAIS EM CÁPSULA",Suplementos alimentares
"SUPLEMENTO ALIMENTAR DE FENO GREGO, LARANJA MORO, CARNITINA, TEANINA, VITAMINAS E MINERAIS EM CÁPSULA",Suplementos alimentares
"SUPLEMENTO ALIMENTAR DE FENO GREGO, TAURINA, ARGININA, VITAMINAS E MINERAIS EM CÁPSULA",Suplementos alimentares
"SUPLEMENTO ALIMENTAR DE FENO GREGO, TAURINA, VITAMINAS E MINERAIS EM CÁPSULA",Suplementos alimentares
"SUPLEMENTO ALIMENTAR DE FENO GREGO, TAURINA, VITAMINAS E MINERAIS EM CÁPSULA EM CÁPSULA",Suplementos alimentares
"SUPLEMENTO ALIMENTAR DE FENO GREGO, VITAMINAS E MINERAIS EM CÁPSULA",Suplementos alimentares
SUPLEMENTO ALIMENTAR DE FIBRAS ALIMENTARES E VITAMINAS EM PÓ,Suplementos alimentares
"SUPLEMENTO ALIMENTAR DE FOSFATIDILSERINA, CAFEÍNA, TEANINA, TIROSINA, TAURINA, VITAMINAS E MINERAIS EM CÁPSULA",Suplementos alimentares
"SUPLEMENTO ALIMENTAR DE FOSFATIDILSERINA, CAFEÍNA, TEANINA, TIROSINA, VITAMINAS E MINERAIS EM CÁPSULA",Suplementos alimentares
"SUPLEMENTO ALIMENTAR DE FOSFATIDILSERINA, L-TIROSINA, TAURINA , VITAMINAS E MINERAIS EM CÁPSULA",Suplementos alimentares
"SUPLEMENTO ALIMENTAR DE GABA, MELATONINA, TRIPTOFANO, VITAMINAS E MINERAIS",Suplementos alimentares
"SUPLEMENTO ALIMENTAR DE GLICINA, L-TIROSINA, TAURINA, COENZIMA Q10, CAFEÍNA, VITAMINAS E MINERAIS EM PÓ",Suplementos alimentares
"SUPLEMENTO ALIMENTAR DE GLICINA,TRIPTOFANO, INOSITOL, TAURINA, TEANINA E MAGNÉSIO EM PÓ",Suplementos alimentares
"SUPLEMENTO ALIMENTAR DE GLICNA, L-TEANINA, TAURINA E MINERAIS EM EMULSÃO",Suplementos alimentares
"SUPLEMENTO ALIMENTAR DE GLUCOSAMINA, CONDROITINA, ÁCIDO HIALURÔICO, COLÁGENO TIPO II NÃO DESNATURADO, CURCUMA E MINERAIS EM CÁPSULA",Suplementos alimentares
"SUPLEMENTO ALIMENTAR DE GLUTAMINA, BETA-GLUCANA, SEMENTE DE UVA, CRANBERRY E VITAMINAS EM CÁPSULA",Suplementos alimentares
"SUPLEMENTO ALIMENTAR DE INOSITOL, COENZIMA Q10, DHA E EPA, VITAMINAS E MINERAIS EM CÁPSULA",Suplementos alimentares
"SUPLEMENTO ALIMENTAR DE INOSITOL, COENZIMA Q10, VITAMINAS E MINERAIS EM CÁPSULA",Suplementos alimentares
"SUPLEMENTO ALIMENTAR DE INOSITOL, COENZIMA Q10, VITAMINAS E MINERAIS EM EMULSÃO",Suplementos alimentares
"SUPLEMENTO ALIMENTAR DE INOSITOL, GLICNA, TRIPTOFANO, L-TREONINA, MELATONINA, VITAMINAS E MINERAIS EM EMULSÃO",Suplementos alimentares
"SUPLEMENTO ALIMENTAR DE INOSITOL, MELATONINA, GLICINA E MAGNÉSIO EM PÓ",Suplementos alimentares
"SUPLEMENTO ALIMENTAR DE INOSITOL, MELATONINA, TRIPTOFANO, GLICINA E MAGNÉSIO EM PÓ",Suplementos alimentares
"SUPLEMENTO ALIMENTAR DE INOSITOL, MELATONINA, TRIPTOFANO, GLICINA, VITAMINAS E MINERAIS EM PÓ",Suplementos alimentares
"SUPLEMENTO ALIMENTAR DE INOSITOL, TRIPTOFANO, MELATONINA, VITAMINAS E MINERAIS EM SOLUÇÃO",Suplementos alimentares
"SUPLEMENTO ALIMENTAR DE INOSITOL, TRIPTOFANO, VITAMINAS E MINERAIS EM SOLUÇÃO.",Suplementos alimentares
"SUPLEMENTO ALIMENTAR DE L-ARGININA, TAURINA, FENO GREGO, VITAMINA E MINERAIS EM SOLUÇÃO",Suplementos alimentares
SUPLEMENTO ALIMENTAR DE L-CARNITINA E CROMO EM EMULSÃO,Suplementos alimentares
"SUPLEMENTO ALIMENTAR DE L-CARNITINA, CAFÉ VERDE EM EMULSÃO.",Suplementos alimentares
"SUPLEMENTO ALIMENTAR DE L-CISTEÍNA, METILSULFONILMETANO, VITAMINAS E MINERAIS EM CÁPSULAS",Suplementos alimentares
"SUPLEMENTO ALIMENTAR DE L-FENILALANINA, TAURINA, LARANJA MORO E MINERAIS EM CÁPSULA",Suplementos alimentares
"SUPLEMENTO ALIMENTAR DE L-GLUTAMINA, L-LISINA, TRANS-RESVERTROL, VITAMINA C E SELÊNIO EM SOLUÇÃO",Suplementos alimentares
"SUPLEMENTO ALIMENTAR DE L-GLUTAMINA, VITAMINAS E MINERAIS EM CÁPSULA",Suplementos alimentares
"SUPLEMENTO ALIMENTAR DE L-METIONINA, INOSITOL, VITAMINAS E MINERAIS EM CÁPSULA",Suplementos alimentares
"SUPLEMENTO ALIMENTAR DE L-TIROSINA, CARNITINA, ARGININA E MINERAIS EM CÁPSULA",Suplementos alimentares
"SUPLEMENTO ALIMENTAR DE L-TIROSINA, LARANJA MORO, TAURINA, CAFEÍNA, VITAMINAS E MINERAIS EM CÁPSULA",Suplementos alimentares
SUPLEMENTO ALIMENTAR DE LARANJA MORO E MINERAIS EM CÁPSULA,Suplementos alimentares
SUPLEMENTO ALIMENTAR DE LARANJA MORO EM CÁPSULA,Suplementos alimentares
"SUPLEMENTO ALIMENTAR DE LARANJA MORO, CAFEIN, TEANINA, CAFE VERDE E MINERIAS EM CAPSULA",Suplementos alimentares
"SUPLEMENTO ALIMENTAR DE LARANJA MORO, CAFÉ VERDE, BETA-ALANINA E L-ARGININA EM CÁPSULA",Suplementos alimentares
"SUPLEMENTO ALIMENTAR DE LARANJA MORO, CAFÉ VERDE, CRANBERRY, VITAMINAS E MINERAIS EM CÁPSULA",Suplementos alimentares
"SUPLEMENTO ALIMENTAR DE LARANJA MORO, CAFÉ VREDE, TRANS-RESVERATROL, INOSITOL, L-TEANINA E CROMO EM CÁPSULA",Suplementos alimentares
"SUPLEMENTO ALIMENTAR DE LARANJA MORO, CARNITINA, CAFEÍNA E MINERAIS EM CÁPSULA",Suplementos alimentares
"SUPLEMENTO ALIMENTAR DE LARANJA MORO, FENO GREGO, CAFÉ VERDE, TRIPTOFANO, VITAMINAS E MINERAIS EM CÁPSULA",Suplementos alimentares
"SUPLEMENTO ALIMENTAR DE LARANJA MORO, INOSITOL, N-ACETIL L-CISTEÍNA, FENO GREGO, VITAMINAS E MINERAIS EM CÁPSULA",Suplementos alimentares
"SUPLEMENTO ALIMENTAR DE LARANJA MORO, QUERCETINA, RESVERATROL, CURCUMA, INOSITOL E VITAMINAS EM PÓ",Suplementos alimentares
"SUPLEMENTO ALIMENTAR DE LARANJA MORO, TEANINA, CARNITINA E MINERAIS EM CÁPSULA",Suplementos alimentares
"SUPLEMENTO ALIMENTAR DE LICOPENO, L-CISTEÍNA, ASTAXANTINA, TRANS-RESVERATROL E VITAMINA C EM CÁPSULA",Suplementos alimentares
"SUPLEMENTO ALIMENTAR DE LUTEÍNA, ASTAXANTINA, ZEAXANTINA E VITAMINAS EM EMULSÃO",Suplementos alimentares
"SUPLEMENTO ALIMENTAR DE LUTEÍNA, ZEAXANTINA, VITAMINAS E MINERAIS EM CÁPSULA",Suplementos alimentares
"SUPLEMENTO ALIMENTAR DE LUTEÍNA, ZEAXANTINA, VITAMINAS E MINERAIS EM CÁPSULAS",Suplementos alimentares
SUPLEMENTO ALIMENTAR DE MAGNÉSIO E L-TREONINA EM CÁPSULA,Suplementos alimentares
SUPLEMENTO ALIMENTAR DE MAGNÉSIO EM CÁPSULA,Suplementos alimentares
"SUPLEMENTO ALIMENTAR DE MAGNÉSIO, VITAMINA B6 E L-TEANINA EM CÁPSULA",Suplementos alimentares
"SUPLEMENTO ALIMENTAR DE MELATONINA, TRIPTOFANO, TEANINA, VITAMINAS E MINERAIS EM CÁPSULA",Suplementos alimentares
"SUPLEMENTO ALIMENTAR DE METISULFONILMETANO, CÚRCUMA E MINERAIS EM CÁPSULA",Suplementos alimentares
"SUPLEMENTO ALIMENTAR DE METISULFONILMETANO, SILÍCIO, L-CISTEÍNA, BORO, VITAMINAS E MINERAIS EM CÁPSULA",Suplementos alimentares
"SUPLEMENTO ALIMENTAR DE MSM, ACETILCISTEÍNA, COLÁGENO E VITAMINA C EM CÁPSULA",Suplementos alimentares
"SUPLEMENTO ALIMENTAR DE MSM, VITAMINAS E MINERAIS EM CÁPSULA",Suplementos alimentares
SUPLEMENTO ALIMENTAR DE N-ACETIL L-CISTEÍNA E TRANS-RESVERATROL EM CÁPSULA,Suplementos alimentares
"SUPLEMENTO ALIMENTAR DE PALMITOILETANOAMIDA, ÁCIDO HIALURÔNICO, COLÁGENO TIPO II NÃO DESNATURADO, CURCUMA E MAGNÉSIO EM CÁPSULAS",Suplementos alimentares
"SUPLEMENTO ALIMENTAR DE PALMITOILETANOLAMIDA, METISULFONILMETANO, CÚRCUMA, FENO GREGO, BETA ALANINA, VITAMINAS E MINERAIS EM CÁPSULA",Suplementos alimentares
"SUPLEMENTO ALIMENTAR DE PEPTÍDEOS BIOATIVOS DE COLÁGENO, VITAMINAS E MINERAIS EM PÓ",Suplementos alimentares
"SUPLEMENTO ALIMENTAR DE PEPTÍDEOS BIOATIVOS DE COLÁGENO, ÁCIDO HIALURÔNICO, VITAMINAS E MINERAIS EM PÓ.",Suplementos alimentares
"SUPLEMENTO ALIMENTAR DE QUERCETINA, CRANBERRY, VITAMINAS E MINERAIS EM CÁPSULA",Suplementos alimentares
"SUPLEMENTO ALIMENTAR DE RESVERATROL, COENZIMA Q10 VITAMINAS E MINERAIS EM CÁPSULA",Suplementos alimentares
"SUPLEMENTO ALIMENTAR DE SEMENTE DE UVA, CRANBERRY, CURCUMA, QUERCETINA, VITAMINAS E MINERAIS EM CÁPSULA",Suplementos alimentares
"SUPLEMENTO ALIMENTAR DE SILÍCIO, VITAMINAS E MINERAIS EM CÁPSULA",Suplementos alimentares
"SUPLEMENTO ALIMENTAR DE SUPLEMENTO DE CAFEÍNA, TAURINA, ARGININA, BETA-ALANINA E L-TIROSINA EM PÓ",Suplementos alimentares
"SUPLEMENTO ALIMENTAR DE SUPLEMENTO DE L-LEUCINA, HIDROXIMETILBUTIRATO E CREATINA EM PÓ",Suplementos alimentares
SUPLEMENTO ALIMENTAR DE SUPLEMENTO DE PROTEÍNA DE SORO DO LEITE CONCENTRADA EM PÓ,Suplementos alimentares
"SUPLEMENTO ALIMENTAR DE TAURINA, ARGININA, BORO, FENO GREGO, VITAMINAS E MINERAIS EM CÁPSULA",Suplementos alimentares
"SUPLEMENTO ALIMENTAR DE TAURINA, ARGININA, CAFEÍNA, LICOPENO, VITAMINAS E MINERAIS EM SOLUÇÃO",Suplementos alimentares
"SUPLEMENTO ALIMENTAR DE TAURINA, ARGININA, CARNITINA, CAFEÍNA, FENO GREGO, LICOPENO, VITAMINAS E MINERAIS EM EMULSÃO.",Suplementos alimentares
"SUPLEMENTO ALIMENTAR DE TAURINA, ARGININA, FENO GREGO, VITAMINAS E MINERAIS EM EMULSÃO.",Suplementos alimentares
"SUPLEMENTO ALIMENTAR DE TAURINA, BETA-ALANINA, L-TIROSINA, ALGA CHONDRUS CRISPUS INVERNAL E VITAMINA B12 EM CÁPSULA",Suplementos alimentares
"SUPLEMENTO ALIMENTAR DE TAURINA, CAFEÍNA, CARNITINA, LICOPENO, VITAMINAS E MINERAIS EM CÁPSULA",Suplementos alimentares
"SUPLEMENTO ALIMENTAR DE TAURINA, CAFEÍNA, LARANJA MORO, CAFÉ VERDE, TRIPTOFANO, CURCUMA, VITAMINAS E MINERAIS EM CÁPSULA",Suplementos alimentares
"SUPLEMENTO ALIMENTAR DE TAURINA, CAFÉ VERDE, ACETILCISTEÍNA, VITAMINAS E MINERAIS EM CÁPSULAS",Suplementos alimentares
"SUPLEMENTO ALIMENTAR DE TAURINA, COENZIMA Q10, FOSFATIDILSERINA, INOSITOL, VITAMINAS E MINERAIS EM PÓ",Suplementos alimentares
"SUPLEMENTO ALIMENTAR DE TAURINA, COENZIMA, VITAMINAS E MINERAIS EM SOLUÇÃO.",Suplementos alimentares
"SUPLEMENTO ALIMENTAR DE TAURINA, FOSFATIDILSERINA, COENZIMA Q10, L-TIROSINA, L-TREONINA, VITAMINAS E MINERAIS EM CÁPSULA",Suplementos alimentares
"SUPLEMENTO ALIMENTAR DE TAURINA, FOSFATIDILSERINA, TRIPTOFANO, ÁCIDO L-GLUTÂMICO, L-TEANINA, NIACINA E L-FENILALANINA EM CÁPSULA",Suplementos alimentares
"SUPLEMENTO ALIMENTAR DE TAURINA, L-TIROSINA, FOSFATIDILSERINA, DHA E EPA, CAFEÍNA, VITAMINAS E MINERAIS EM CÁPSULA",Suplementos alimentares
"SUPLEMENTO ALIMENTAR DE TIROSINA, LARANJA MORO, CAFÉ VERDE, TAURINA, VITAMINAS E MINERAIS EM CÁPSULA",Suplementos alimentares
"SUPLEMENTO ALIMENTAR DE TIROSINA, TRIPTOFANO, COENZIMA Q10, FOSFATIDILSERINA, VITAMINAS E MINERAIS EM CÁPSULA",Suplementos alimentares
SUPLEMENTO ALIMENTAR DE TRANS-RESVERATROL EM CÁPSULA,Suplementos alimentares
"SUPLEMENTO ALIMENTAR DE TRANS-RESVERATROL, CAFÉ VERDE, LARANJA MORO E CROMO EM CÁPSULAS",Suplementos alimentares
"SUPLEMENTO ALIMENTAR DE TRANS-RESVERATROL, CURCUMA, COENZIMA Q10, VITAMINAS E MINERAIS EM CÁPSULA",Suplementos alimentares
"SUPLEMENTO ALIMENTAR DE TRANS-RESVERATROL, LARANJA MORO, CAFÉ VERDE, TRIPTOFANO, CURCUMA E MINERAIS EM CÁPSULA",Suplementos alimentares
"SUPLEMENTO ALIMENTAR DE TRANS-RESVERATROL, ÁCIDO HIALURÔNICO, METILSULFONILMETANO, VITAMINAS E MINERAIS EM CÁPSULAS",Suplementos alimentares
"SUPLEMENTO ALIMENTAR DE TRIPTOFANO, CAFEÍNA, ÁCIDO L-ASPÁRTICO, TAURINA, GLICINA, FOSFATIDILSERINA, VITAMINAS E MINERAIS EM CÁPSULA",Suplementos alimentares
"SUPLEMENTO ALIMENTAR DE TRIPTOFANO, GLICINA, MELATONINA, VITAMINAS E MINERAIS EM CÁPSULAS",Suplementos alimentares
"SUPLEMENTO ALIMENTAR DE TRIPTOFANO, MELATONINA, COENZIMA Q10, VITAMINAS E MINERAIS EM EMULSÃO",Suplementos alimentares
"SUPLEMENTO ALIMENTAR DE TRIPTOFANO, MELATONINA, MAGNÉSIO E VITAMINA B6 EM PÓ",Suplementos alimentares
"SUPLEMENTO ALIMENTAR DE TRIPTOFANO, MELATONINA, RESVERATROL, INOSITOL, VITAMINAS E MINERAIS EM CÁPSULA",Suplementos alimentares
SUPLEMENTO ALIMENTAR DE VITAMINA D E VITAMINA K EM CÁPSULA,Suplementos alimentares
SUPLEMENTO ALIMENTAR DE VITAMINA D EM CÁPSULA,Suplementos alimentares
SUPLEMENTO ALIMENTAR DE VITAMINA E EM CAPSULA,Suplementos alimentares
SUPLEMENTO ALIMENTAR DE VITAMINA K EM CÁPSULA,Suplementos alimentares
SUPLEMENTO ALIMENTAR DE VITAMINA S E MINERAIS EM CÁPSULA,Suplementos alimentares
SUPLEMENTO ALIMENTAR DE VITAMINAS E MINERAIS EM CÁPSULA,Suplementos alimentares
SUPLEMENTO ALIMENTAR DE VITAMINAS E MINERAIS EM EMULSÃO,Suplementos alimentares
SUPLEMENTO ALIMENTAR DE VITAMINAS E MINERAIS EM SOLUÇÃO,Suplementos alimentares
SUPLEMENTO ALIMENTAR DE VITAMINAS E MINERAIS EM SOLUÇÃO.,Suplementos alimentares
SUPLEMENTO ALIMENTAR DE VITAMINAS EM CÁPSULA,Suplementos alimentares
SUPLEMENTO ALIMENTAR DE VITAMINAS EM EMULSÃO,Suplementos alimentares
SUPLEMENTO ALIMENTAR DE ZINCO EM CÁPSULA,Suplementos alimentares
"SUPLEMENTO ALIMENTAR DE ÁCIDO ALFA-LINOLÊNICO N-3, ARGININA, LARANJA MORO, VITAMINAS E MINERAIS EM CÁPSULA",Suplementos alimentares
SUPLEMENTO ALIMENTAR DE ÁCIDO GAMA AMINOBUTÍRICO EM CÁPSULA,Suplementos alimentares
"SUPLEMENTO ALIMENTAR DE ÁCIDO HIALURÔNICO, COLÁGENO TIPO II NÃO DESNATURADO, L-METIONINA, L-CISTEÍNA, VITAMINAS E MINERAIS EM PÓ",Suplementos alimentares
"SUPLEMENTO ALIMENTAR DE ÁCIDO HIALURÔNICO, COLÁGENO TIPO II, LUTEÍNA, ZEAXANTINA, VITAMINAS E MINERAIS EM EMULSÃO.",Suplementos alimentares
"SUPLEMENTO ALIMENTAR DE ÁCIDO HIALURÔNICO, CURCUMA, CONDROITINA, GLUCOSAMINA, VITAMINAS E MINERAIS EM EMULSÃO",Suplementos alimentares
"SUPLEMENTO ALIMENTAR DE ÁCIDO HIALURÔNICO, TRANS-RESVERATROL, ASTAXANTINA, SELÊNIO E VITAMINAS EM EMULSÃO.",Suplementos alimentares
"SUPLEMENTO ALIMENTAR DE ÁCIDO HIALURÔNICO, TRANS-RESVERATROL, COENZIMA Q10, VITAMINAS E MINERAIS EM CÁPSULA",Suplementos alimentares
"SUPLEMENTO ALIMENTAR DE ÁCIDO HIALURÔNICO, TRANS-RESVERATROL, PINUS PINASTER, VITAMINAS E MINERAIS EM CÁPSULA",Suplementos alimentares
"SUPLEMENTO ALIMENTAR DE ÁCIDO HIALURÔNICO, VITAMINAS E MINERAIS EM CÁPSULA",Suplementos alimentares
"SUPLEMENTO ALIMENTAR DE ÁCIDO HIALURÔNICO, VITAMINAS E MINERAIS EM SOLUÇÃO",Suplementos alimentares
"SUPLEMENTO ALIMENTAR DE ÁCIDO HIALURÔNICO, VITAMINAS, MINERAIS, MSM, AMINOACIDOS EM CÁPSULA",Suplementos alimentares
SUPLEMENTO ALIMENTAR DE ÔMEGA 3 E CÚRCUMA EM CÁPSULA,Suplementos alimentares
"SUPLEMENTO ALIMENTAR DE ÔMEGA 3, COENZIMA Q10 E VITAMINA D EM CÁPSULA",Suplementos alimentares
SUPLEMENTO ALIMENTAR COM ÓLEO DE PEIXE COM VITAMINA E EM CÁPSULAS,Suplementos alimentares
"SUPLEMENTO ALIMENTAR COM ÓLEO DE PEIXE, VITAMINAS E COENZIMA Q10 EM CÁPSULASE VITAMINA E EM CÁPSULAS",Suplementos alimentares
"SUPLEMENTO ALIMENTAR DE AMINOÁCIDOS, VITAMINAS E COLINA EM PÓ",Suplementos alimentares
SUPLEMENTO ALIMENTAR DE ESPIRULINA EM TABLETES,Suplementos alimentares
SUPLEMENTO ALIMENTAR DE FERRO EM CÁPSULAS,Suplementos alimentares
SUPLEMENTO ALIMENTAR DE IODO EM CÁPSULAS,Suplementos alimentares
SUPLEMENTO ALIMENTAR DE L-TRIPTOFANO EM CÁPSULAS,Suplementos alimentares
SUPLEMENTO ALIMENTAR DE LICOPENO EM CÁPSULAS,Suplementos alimentares
"SUPLEMENTO ALIMENTAR DE LUTEÍNA, ZEAXANTINA, VITAMINAS E ZINCO EM CÁPSULAS",Suplementos alimentares
SUPLEMENTO ALIMENTAR DE MAGNÉSIO COM INOSITOL EM CÁPSULAS,Suplementos alimentares
SUPLEMENTO ALIMENTAR DE MAGNÉSIO COM TREONINA EM CÁPSULAS,Suplementos alimentares
"SUPLEMENTO ALIMENTAR DE MELATONINA, L-TRIPTOFANO, MAGNÉSIO E VITAMINA B12 EM CÁPSULAS",Suplementos alimentares
SUPLEMENTO ALIMENTAR DE N-ACETIL L-CISTEÍNA E MINERAIS EM CÁPSULAS,Suplementos alimentares
SUPLEMENTO ALIMENTAR DE N-ACETIL L-CISTEÍNA EM CÁPSULAS,Suplementos alimentares
SUPLEMENTO ALIMENTAR DE QUERCETINA E RESVERATROL COM TCM EM CÁPSULAS,Suplementos alimentares
"SUPLEMENTO ALIMENTAR DE VITAMINA C, TCM E ZINCO QUELATO EM CÁPSULAS",Suplementos alimentares
"SUPLEMENTO ALIMENTAR DE VITAMINA C, ZINCO E VITAMINA D EM CÁPSULAS",Suplementos alimentares
SUPLEMENTO ALIMENTAR DE VITAMINA D COM VITAMINA K EM CÁPSULAS,Suplementos alimentares
SUPLEMENTO ALIMENTAR DE VITAMINA D3 E VITAMINA K2 COM TCM EM CÁPSULAS,Suplementos alimentares
"SUPLEMENTO ALIMENTAR DE VITAMINAS DO COMPLEXO B, ÓLEO DE COCO EXTRA VIRGEM COM TCM EM CÁPSULAS",Suplementos alimentares
"SUPLEMENTO ALIMENTAR DE VITAMINAS, COLINA E INOSITOL.",Suplementos alimentares
"SUPLEMENTO ALIMENTAR DE ZINCO, MAGNÉSIO E VITAMINA B6 EM CÁPSULAS",Suplementos alimentares
"SUPLEMENTO ALIMENTAR DE ÁCIDO FÓLICO, VITAMINA B12, VITAMINA B6, VITAMINA E COM TCM EM CÁPSULAS",Suplementos alimentares
SUPLEMENTO ALIMENTAR DE ÁCIDO HIALURÔNICO EM CÁPSULAS,Suplementos alimentares
SUPLEMENTO ALIMENTAR DE ÓLEO DE PEIXE COM ALTO TEOR DE DHA EM CÁPSULAS,Suplementos alimentares
SUPLEMENTO ALIMENTAR DE ÓLEO DE PEIXE COM ÔMEGA 3 EM CÁPSULAS,Suplementos alimentares
"SUPLEMENTO ALIMENTAR DE ÓLEO DE PEIXE, VITAMINA E, ASTAXANTINA, LUTEÍNA E ZEAXANTINA EM CAPSULAS",Suplementos alimentares
Sulpemento Alimentar de Coenzima Q10 com Óleo de Peixe e Vitamina E e D em Cápsulas,Suplementos alimentares
Suplemento Alimentar Bisglicinato de Magnésio com L-Treonina,Suplementos alimentares
Suplemento Alimentar Colágeno Tipo 2,Suplementos alimentares
"Suplemento Alimentar Composto por Cálcio orgânico, Magnésio quelato, Vitamina K2 e Vitamina D3",Suplementos alimentares
"Suplemento Alimentar Composto por Óleo de Linhaça, Óleo de Prímula e Óleo de Borragem (extraídos por prensagem a frio) com vitamina E",Suplementos alimentares
Suplemento Alimentar Creatina Monohidratada Micronizada,Suplementos alimentares
Suplemento Alimentar Magnésio Dimalato,Suplementos alimentares
Suplemento Alimentar Psyllium,Suplementos alimentares
"Suplemento Alimentar com formulação altamente concentrada que reúne Laranja Moro, Óleo de Cártamo Prensado a Frio, Picolinato de Cromo e Metilcobalamina (Vitamina B12 ativa)",Suplementos alimentares
"Suplemento Alimentar de Acetilcisteína, Vitamina D3, Zinco e Molibdênio em Cápsulas",Suplementos alimentares
Suplemento Alimentar de Coenzima Q10 (Ubidecarenona),Suplementos alimentares
"Suplemento Alimentar de Coenzima Q10, Taurina, Zinco Quelato, Metilcobalamina e TCM em cápsulas",Suplementos alimentares
Suplemento Alimentar de Cromo em Cápsulas,Suplementos alimentares
Suplemento Alimentar de Extrato de Rizomas de Curcuma Longa em cápsulas,Suplementos alimentares
Suplemento Alimentar de L-Triptofano em Cápsulas,Suplementos alimentares
"Suplemento Alimentar de Laranja Moro, Café Verde, Minerais e Vitamina B12 com TCM em Cápsulas.",Suplementos alimentares
Suplemento Alimentar de Magnésio e Vitamina D,Suplementos alimentares
Suplemento Alimentar de Minerais e Vitamina B6 em Cápsulas,Suplementos alimentares
Suplemento Alimentar de N-acetilcisteína (NAC) em cápsulas,Suplementos alimentares
"Suplemento Alimentar de Taurina, L-Tirosina, Fosfatidilserina de lecitina de soja, Colina, Vitamina E, Vitamina B6, Óleo de coco extra virgem e TCM",Suplementos alimentares
Suplemento Alimentar de Vitamina D e Vitamina K em Cápsulas,Suplementos alimentares
Suplemento Alimentar de Vitamina D em Cápsulas,Suplementos alimentares
Suplemento Alimentar de Vitamina K2 Menaquinona,Suplementos alimentares
Suplemento Alimentar de Vitaminas e Minerais em Cápsulas,Suplementos alimentares
Suplemento Alimentar Ômega 3 Super EPA,Suplementos alimentares
Suplemento alimentar de Óleo de Peixe Sabor Cereja em cápsulas mastigáveis,Suplementos alimentares
Suplemento Alimentar de Magnésio Granulado para Solução,Suplementos alimentares
SUPLEMENTO ALIMENTAR DE CARBOIDRATOS E ELETRÓLITOS,Suplementos alimentares
SUPLEMENTO ALIMENTAR DE ELETRÓLITOS,Suplementos alimentares
SUPLEMENTOALIMENTAR DE PROTEÍNA LIQUIDO,Suplementos alimentares
Suplemento Alimentar de Ferro em solução gotas,Suplementos alimentares
SUPLEMENTO ALIMENTAR DE COBRE E ZINCO EM CÁPSULAS,Suplementos alimentares
SUPLEMENTO ALIMENTAR DE COLÁGENO TIPO II EM CÁPSULAS,Suplementos alimentares
SUPLEMENTO ALIMENTAR DE EXTRATO DE PRÓPOLIS EM CÁPSULAS,Suplementos alimentares
SUPLEMENTO ALIMENTAR DE LISINA EM CÁPSULAS,Suplementos alimentares
SUPLEMENTO ALIMENTAR DE MAGNÉSIO CITRATO MALATO EM CÁPSULAS,Suplementos alimentares
SUPLEMENTO ALIMENTAR DE MINERAIS QUELATADOS EM CÁPSULAS,Suplementos alimentares
SUPLEMENTO ALIMENTAR DE TAURINA EM CÁPSULAS,Suplementos alimentares
