nomeProduto,categoria
Suplemento alimentar à base de colágeno,Suplementos alimentares
Suplemento alimentar à base de proteína do soro do leite (whey protein),Suplementos alimentares
Suplemento alimentar à base de proteína do soro do leite (whey protein) concentrada,Suplementos alimentares
Suplemento alimentar à base de proteína do soro do leite (whey protein) sabor chocolate em pó,Suplementos alimentares
VEGAN ISO,Suplementos alimentares
SUPLEMENTO ALIMENTAR DE PROTEÍNA EM PÓ - BEEF PROTEIN,Suplementos alimentares
SUPLEMENTO ALIMENTAR DE PROTEÍNA EM PÓ - WHEY PROTEIN ZERO LACTOSE,Suplementos alimentares
SUPLEMENTO ALIMENTAR DE PROTEÍNAS EM PÓ - ISO PROTEIN BLEND,Suplementos alimentares
SUPLEMENTO ALIMENTAR EM CÁPSULAS DE MAGNÉSIO 350 MG,Suplementos alimentares
SUPLEMENTO ALIMENTAR EM CÁPSULAS DE VITAMINA C 500 MG,Suplementos alimentares
Suplemento Alimentar em Capsulas,Suplementos alimentares
"Suplemente em pó de Magnésio, Triptofano, Inositol e vitamina B6.",Suplementos alimentares
Suplemente em pó de proteína concentrada de soro de leite,Suplementos alimentares
Suplemento alimentar a base de colágeno hidrolisado e de peptídeos bioativos de colágeno hidrolisado com peso molecular médio 2kDa.,Suplementos alimentares
Suplemento alimentar em pó de whey protein com creatina,Suplementos alimentares
Whey Protein Concentrado Chocolate,Suplementos alimentares
CREATINA MONOHIDRATADA MICRONIZADA,Suplementos alimentares
"SUPLEMENTO ALIMENTAR DE BACILLUS CLAUSII O/C, SIN, N/R, T EM GRÂNULOS",Suplementos Alimentares Contendo Probióticos e/ou Enzimas
"SUPLEMENTO ALIMENTAR DE Bacillus clausii O/C, SIN, N/R, T EM SUSPENSÃO ORAL",Suplementos Alimentares Contendo Probióticos e/ou Enzimas
Suplemento alimentar de colágeno tipo II e cúrcuma,Suplementos alimentares
"Suplemento alimentar de creatina, L-arginina, vitaminas e minerais (Crethinex homem)",Suplementos alimentares
"Suplemento alimentar de creatina, colágeno, vitaminas e minerais (Creathinex Mulher)",Suplementos alimentares
Suplemento alimentar de magnésio,Suplementos alimentares
Suplemento alimentar de silício,Suplementos alimentares
"Suplemento alimentar em pó de creatina, colina, L-teanina, magnésio e vitaminas do complexo B",Suplementos alimentares
"Suplemento alimentar em pó de creatina, colágeno hidrolisado, cálcio, magnésio e vitaminas D e K (creatina sênior)",Suplementos alimentares
Suplemnto alimentar de de magnésio,Suplementos alimentares
Suplemento alimentar de extrato seco de própolis verde em cápsulas,Suplementos alimentares
SUPLEMENTO ALIMENTAR DE PROTEINAS EM BARRA,Suplementos alimentares
SUPLEMENTO ALIMENTAR DE VITAMINAS E MINERAIS,Suplementos alimentares
SUPLEMENTO ALIMENTAR DE VITAMINAS E MINERAIS - LIQUIDO,Suplementos alimentares
"SUPLEMENTO ALIMENTAR DE VITAMINAS, MINERAIS E OLEO DE PEIXE",Suplementos alimentares
TOTALVITA AZ 700MG - 60 CAPSULAS - SOFTGEL,Suplementos alimentares
Colostro Bovino Integral em Pó Liofilizado,Suplementos alimentares
Bioforce Capsulas suplemento alimentar,Suplementos alimentares
Vita Care Cabelos & Unhas,Suplementos alimentares
"SOPINHA DE BATATA DOCE, CARNE, GRÃO DE BICO, CENOURA E VAGEM",ALIMENTOS INFANTIS
"SOPINHA DE BETERRABA, CARNE BOVINA, BATATA, CENOURA E ABOBRINHA",ALIMENTOS INFANTIS
"SOPINHA DE CARNE BOVINA, ARROZ 7 GRÃOS E LEGUMES",ALIMENTOS INFANTIS
"SOPINHA DE CARNE, MASSINHA, CENOURA, ABOBRINHA BATATA INGLESA, VAGEM E TEMPERO VERDE",ALIMENTOS INFANTIS
"SOPINHA DE ERVILHA SECA, FRANGO, BATATA INGLESA, ABOBRINHA E COUVE FLOR",ALIMENTOS INFANTIS
"SOPINHA DE FEIJÃO, CARNE BOVINA, MACARRÃO E LEGUMES",ALIMENTOS INFANTIS
"SOPINHA DE FEIJÃO, CARNE BOVINA, MORANGA E BATATA",ALIMENTOS INFANTIS
"SOPINHA DE MANDIOCA, FRANGO E LEGUMES",ALIMENTOS INFANTIS
"SOPINHA DE MORANGA, CARNE BOVINA, BATATA, BRÓCOLIS E ABOBRINHA",ALIMENTOS INFANTIS
"Sopinha de lentilha, frango e legumes",ALIMENTOS INFANTIS
Suplemento Alimentar líquido em gotas,Suplementos alimentares
"Suplemento Alimentar Extrato de Laranja Moro, Tartarato de L-Carnitina, Extrato de Café Verde, Quercetina, Extrato Seco de Semente de Uva (Proantocianidina), Espirulina, Chlorella Vulgaris, Picolinato de Cromo em Comprimidos Reves",Suplementos alimentares
Suplemento Alimentar de Acetilcisteína em Comprimidos Revestidos,Suplementos alimentares
Suplemento Alimentar de Aminoácido com Vitaminas e Minerais em comprimidos revestidos,Suplementos alimentares
Suplemento Alimentar de Aminoácido com Vitaminas e Minerais em comprimidos revestidos II,Suplementos alimentares
Suplemento Alimentar de Coenzima Q10 e Vitamina E em Cápsulas Moles,Suplementos alimentares
Suplemento Alimentar de Creatina e Vitaminas em Pó.,Suplementos alimentares
"Suplemento Alimentar de Creatina em Gomas Mastigáveis  Sabores: Laranja, Damasco e Manga",Suplementos alimentares
Suplemento Alimentar de Creatina em gomas mastigáveis - Sabor Maçã Verde,Suplementos alimentares
Suplemento Alimentar de Cálcio e Vitamina D3 em comprimidos revestidos,Suplementos alimentares
Suplemento Alimentar de Cúrcuma Longa e Magnésio Quelato em Comprimidos Revestidos,Suplementos alimentares
"Suplemento Alimentar de Cúrcuma, Hidroximetilbutirato, Metilsulfonilmetano, Magnésio, Colágeno tipo II, Ácido Hialurônico, Vitamina D3, Boro e Glicina - comprimidos revestidos",Suplementos alimentares
"Suplemento Alimentar de Ferro, Vitamina C e Ácido Fólico em Cápsulas Softgel",Suplementos alimentares
"Suplemento Alimentar de Magnésio, Cálcio, Vitamina D3 e Vitamina K2 em comprimidos revestidos",Suplementos alimentares
"Suplemento Alimentar de Magnésio, Zinco, Saponinas, Boro, Vitamina D e Vitamina B6 em comprimidos revestidos.",Suplementos alimentares
Suplemento Alimentar de Melatonina e Vitamina B6 em comprimidos mastigáveis,Suplementos alimentares
Suplemento Alimentar de Melatonina em Comprimidos Mastigáveis,Suplementos alimentares
Suplemento Alimentar de Metilcobalamina (Vitamina B12) em comprimidos mastigáveis,Suplementos alimentares
Suplemento Alimentar de Metilcobalamina (Vitamina B12) em comprimidos revestidos,Suplementos alimentares
Suplemento Alimentar de Metilcobalamina e Metilfolato de Cálcio em Comprimidos Mastigáveis,Suplementos alimentares
"Suplemento Alimentar de Metilfolato de Cálcio, Vitamina B6, Metilcobalamina e Vitamina E em comprimidos revestidos.",Suplementos alimentares
Suplemento Alimentar de Multivitamínicos e Multiminerais em Cápsulas Gelatinosas,Suplementos alimentares
"Suplemento Alimentar de Tartarato de L-Carnitina, Picolinato de Cromo, Extrato de Laranja Moro, Cafeína, Extrato de Café Verde, Extrato Seco de Semente de Uva, Espirulina e Chorella Vulgaris em comprimidos revestidos",Suplementos alimentares
"Suplemento Alimentar de Taurina, Beta Alanina, Extrato de Laranja Moro, Cafeína e Mineral Boro em comprimidos revestidos",Suplementos alimentares
Suplemento Alimentar de Vitamina C e Zinco Quelato em comprimidos revestidos.,Suplementos alimentares
Suplemento Alimentar de Vitamina C em comprimidos revestidos,Suplementos alimentares
"Suplemento Alimentar de Vitamina E, Boro, Zinco, Cloridrato de Piridoxina (Vitamina B6), Extrato de Cacau (Compostos Fenólicos), Taurina e Cafeína em comprimidos revestidos.",Suplementos alimentares
Suplemento Alimentar de Vitaminas e Minerais em Comprimidos Revestidos,Suplementos alimentares
Suplemento Alimentar de Vitaminas e Minerais em comprimidos revestidos,Suplementos alimentares
Suplemento Alimentar de Zinco em Comprimidos,Suplementos alimentares
Suplemento Alimentar em Comprimidos Efervescentes,Suplementos alimentares
Suplemento Alimentar em Comprimidos Revestidos.,Suplementos alimentares
Suplemento Alimentar em comprimidos revestidos III,Suplementos alimentares
Suplemento Alimentar em comprimidos revestidos.,Suplementos alimentares
"SUPLEMENTO ALIMENTAR DE CAFEÍNA, CROMO, COLINA, TIROSINA EM CÁPSULAS",Suplementos alimentares
SUPLEMENTO ALIMENTAR DE CURCUMA LONGA EM CÁPSULAS,Suplementos alimentares
SUPLEMENTO ALIMENTAR DE L-CARNITINA EM CÁPSULAS,Suplementos alimentares
SUPLEMENTO ALIMENTAR DE METILCOBALAMINA EM CÁPSULAS,Suplementos alimentares
"SUPLEMENTO ALIMENTAR DE METILSULFONILMETANO, ÁCIDO HIALURÔNICO, COLÁGENO TIPO ii E MANGANÊS EM CÁPSULAS",Suplementos alimentares
"SUPLEMENTO ALIMENTAR EM CÁPSULAS A BASE DE CÁLCIO, MAGNÉSIO, VITAMINA K E VITAMINA D",Suplementos alimentares
"SUPLEMENTO ALIMENTAR EM CÁPSULAS A BASE DE VITAMINA B6, FENILALANINA, TRIPTOFANO E MELATONINA",Suplementos alimentares
"SUPLEMENTO ALIMENTAR EM CÁPSULAS DE VITAMINA B6, VITAMINA B3, VITAMINA E, FOSFATIDILSERINA, TAURINA, TIROSINA, CAFEÍNA E BITARTARATO DE COLINA.",Suplementos alimentares
SUPLEMENTO ALIMENTAR EM CÁPSULAS DE VITAMINAS E MINERAIS,Suplementos alimentares
SUPLEMENTO ALIMENTAR LÍQUIDO DE MELATONINA EM GOTAS,Suplementos alimentares
"Suplemento alimentar em cápsulas de Feno Grego, Boro, Magnesio e Zinco",Suplementos alimentares
"Suplemento alimentar em cápsulas de Vitamina C, Vitamina D, Própolis e Zinco",Suplementos alimentares
"Suplemento alimentar em cápsulas de vitamina b6, fenilalanina, triptofano e melatonina.",Suplementos alimentares
SUPLEMENTO ALIMENTAR DE BIOTINA EM COMPRIMIDO MASTIGÁVEL,Suplementos alimentares
SUPLEMENTO ALIMENTAR DE COMPRIMIDO MASTIGÁVEL,Suplementos alimentares
SUPLEMENTO ALIMENTAR DE CREATINA COMPRIMIDO MASTIGÁVEL,Suplementos alimentares
SUPLEMENTO ALIMENTAR DE N-ACETILCISTEÍNA (NAC) EM CÁPSULAS,Suplementos alimentares
SUPLEMENTO ALIMENTAR DE VITAMINA B12 EM COMPRIMIDO E EM CÁPSULAS,Suplementos alimentares
Suplemento alimentar à base de proteína do soro do leite (Whey Protein Concentrado),Suplementos alimentares
Designação do produto: Suplemento Alimentar (comprimido mastigável de Vitamina C). Marca do produto: Neonutrix. Forma Farmacêutica: Comprimido mastigável. Embalagem: Pote contendo 60 comprimidos mastigáveis.,Suplementos alimentares
FLEBOGENOL C/30 COMPRIMIDOS (APRESENTAÇÃO 1) C/60 COMPRIMIDOS (APRESENTAÇÃO 2),Suplementos alimentares
LAC INTESTY- SUPLEMENTO ALIMENTAR EM COMPRIMIDO,Suplementos alimentares
SUPLEMENTO ALIMENTAR (CAPSULA),Suplementos alimentares
SUPLEMENTO ALIMENTAR PASTILHA DE VITAMINA C,Suplementos alimentares
Suplemento alimentar (comprimido de Carbonato de Cálcio),Suplementos alimentares
Suplemento alimentar (solução),Suplementos alimentares
SONHO - EMZ LABORATÓRIO NUTRICIONAL LTDA,Suplementos alimentares
Suplemento Alimentar proteico em pó,Suplementos alimentares
Suplemento alimentar em cápsula dura,Suplementos alimentares
Suplemento alimentar em gotas,Suplementos alimentares
Suplemento alimentar de vitaminas e minerais em Cápsulas,Suplementos alimentares
Suplemento alimentar probióticos em Cápsulas,Suplementos alimentares
FRASCO DE PET PÓS CONSUMO RECICLADO GRAU ALIMENTÍCIO MONOCAMADA USO ÚNICO,EMBALAGENS NOVAS TECNOLOGIAS ( RECICLADAS )
SUPLEMENTO ALIMENTAR DE LACTOBACILLUS RHAMNOSUS 19070-2 E LACTOBACILLUS REUTERI DSM 12246 SUSPENSÃO OLEOSA,Suplementos alimentares
Suplemento alimentar de N-acetil-L-cisteína em cápsulas,Suplementos alimentares
Suplemento alimentar em tablete mastigável sabor chocolate,Suplementos alimentares
BATATA DOCE ROXA COM PANCS PARA LACTENTES E CRIANÇAS DE PRIMEIRA INFÂNCIA,Alimentos de transição para alimentação infantil
Batata à provençal para lactentes e crianças de primeira infância,Alimentos de transição para alimentação infantil
Bolinho de arroz e feijão com cascas e talos,Alimentos de transição para alimentação infantil
Feijão carioca para lactentes e crianças de primeira infância,Alimentos de transição para alimentação infantil
Feijão preto com couve para lactentes e crianças de primeira infância,Alimentos de transição para alimentação infantil
Musculo desfiado para lactentes e crianças de primeira infância,Alimentos de transição para alimentação infantil
PURÊ DE ABÓBORA CABOTIÁ ASSADA,ALIMENTOS INFANTIS
PURÊ DE ARROZ COM COUVE FLOR E QUINOA,ALIMENTOS INFANTIS
PURÊ DE GRÃO DE BICO COM CENOURA,ALIMENTOS INFANTIS
PURÊ DE PANQUECA DE BANANA COM MAÇÃ,ALIMENTOS INFANTIS
SOPINHA DE CARNE COM LEGUMES,ALIMENTOS INFANTIS
SOPINHA DE HAMBURGUINHO DE FRANGO COM BATATA DOCE,ALIMENTOS INFANTIS
SOPINHA DE KIBE DE ABÓBORA,ALIMENTOS INFANTIS
Sopinha de carne com legumes e Sopinha de frango com legumes,Alimentos de transição para alimentação infantil
SUPLEMENTO ALIMENTAR DE CARBOIDRATOS E ELETRÓLITOS COM ZINCO,Suplementos alimentares
SUPLEMENTO ALIMENTAR DE CARBOIDRATOS E ELETRÓLITOS SABOR NATURAL,Suplementos alimentares
SUPLEMENTO ALIMENTAR DE MAGNESIO EM CAPSULA,Suplementos alimentares
SUPLEMENTO ALIMENTAR EM CAPSULA DE CAFEINA,Suplementos alimentares
SUPLEMENTO ALIMENTAR EM CAPSULA DE CALCIO E D3,Suplementos alimentares
SUPLEMENTO ALIMENTAR EM CAPSULA DE MAGNESIO DIMALATO,Suplementos alimentares
SUPLEMENTO ALIMENTAR EM CAPSULA DE VITAMINA B12,Suplementos alimentares
SUPLEMENTO ALIMENTAR EM CAPSULAS DE AZ GESTANTE,Suplementos alimentares
SUPLEMENTO ALIMENTAR EM CAPSULAS DE AZ HOMEM,Suplementos alimentares
SUPLEMENTO ALIMENTAR EM CAPSULAS DE AZ MULHER,Suplementos alimentares
SUPLEMENTO ALIMENTAR EM CAPSULAS DE AZ SENIOR,Suplementos alimentares
SUPLEMENTO ALIMENTAR EM CAPSULAS DE COENZIMA Q10,Suplementos alimentares
"SUPLEMENTO ALIMENTAR EM CAPSULAS DE MDK(CALCIO, MAGNESIO, VITAMINA D E VITAMINA K)",Suplementos alimentares
Colágeno Marinho 100% bioativo,Suplementos alimentares
SOPINHA DE ABOBRINHA,ALIMENTOS INFANTIS
SOPINHA DE ABÓBORA COZIDA,ALIMENTOS INFANTIS
SOPINHA DE ACELGA,ALIMENTOS INFANTIS
SOPINHA DE ARROZ BRANCO,ALIMENTOS INFANTIS
SOPINHA DE ARROZ INTEGRAL,ALIMENTOS INFANTIS
SOPINHA DE ASPARGO,ALIMENTOS INFANTIS
SOPINHA DE BATATA DOCE,ALIMENTOS INFANTIS
SOPINHA DE BATATA INGLESA,ALIMENTOS INFANTIS
SOPINHA DE BERINJELA,ALIMENTOS INFANTIS
SOPINHA DE BETERRABA,ALIMENTOS INFANTIS
SOPINHA DE BRÓCOLIS,ALIMENTOS INFANTIS
SOPINHA DE CARNE ACEBOLADA,ALIMENTOS INFANTIS
SOPINHA DE CARNE MOÍDA,ALIMENTOS INFANTIS
SOPINHA DE CARNE SUÍNA,ALIMENTOS INFANTIS
SOPINHA DE CENOURA,ALIMENTOS INFANTIS
SOPINHA DE CHUCHU,ALIMENTOS INFANTIS
SOPINHA DE COGUMELO PARIS,ALIMENTOS INFANTIS
SOPINHA DE COUVE MANTEIGA,ALIMENTOS INFANTIS
SOPINHA DE COUVE-FLOR,ALIMENTOS INFANTIS
SOPINHA DE CUSCUZ MARROQUINO,ALIMENTOS INFANTIS
SOPINHA DE ERVILHA,ALIMENTOS INFANTIS
SOPINHA DE ERVILHA TORTA,ALIMENTOS INFANTIS
SOPINHA DE ESCAROLA,ALIMENTOS INFANTIS
SOPINHA DE ESPINAFRE,ALIMENTOS INFANTIS
SOPINHA DE FEIJÃO BRANCO,ALIMENTOS INFANTIS
SOPINHA DE FEIJÃO CARIOCA,ALIMENTOS INFANTIS
SOPINHA DE FEIJÃO PRETO,ALIMENTOS INFANTIS
SOPINHA DE FRANGO XADREZ,ALIMENTOS INFANTIS
SOPINHA DE GRÃO DE BICO,ALIMENTOS INFANTIS
SOPINHA DE INHAME (CARÁ),ALIMENTOS INFANTIS
SOPINHA DE LENTILHA,ALIMENTOS INFANTIS
SOPINHA DE MANDIOQUINHA,ALIMENTOS INFANTIS
SOPINHA DE MILHO,ALIMENTOS INFANTIS
SOPINHA DE PEITO DE FRANGO,ALIMENTOS INFANTIS
SOPINHA DE QUIABO,ALIMENTOS INFANTIS
SOPINHA DE REPOLHO BRANCO,ALIMENTOS INFANTIS
SOPINHA DE REPOLHO ROXO,ALIMENTOS INFANTIS
SOPINHA DE SALMÃO,ALIMENTOS INFANTIS
SOPINHA DE TILÁPIA,ALIMENTOS INFANTIS
SOPINHA DE VAGEM,ALIMENTOS INFANTIS
Suplemento Alimentar em Pó de Proteínas,Suplementos alimentares
BEEF PROTEIN ISOLATE,Suplementos alimentares
COLAGENO,Suplementos alimentares
Suplemento Alimentar Líquido Sabor Abacaxi,Suplementos alimentares
Suplemento Alimentar Líquido Sabor Abacaxi com Menta,Suplementos alimentares
Suplemento Alimentar Líquido Sabor Abacaxi e Menta,Suplementos alimentares
Suplemento Alimentar Líquido Sabor Frutas Vermelhas,Suplementos alimentares
Suplemento Alimentar Líquido Sabor Laranja,Suplementos alimentares
Suplemento Alimentar Líquido Sabor Laranja 150ml,Suplementos alimentares
Suplemento Alimentar Líquido Sabor Maracujá,Suplementos alimentares
Suplemento Alimentar Líquido de Acetilcisteína Sabor Laranja,Suplementos alimentares
Suplemento Alimentar Líquido de Ferro Sabor Uva,Suplementos alimentares
"Suplemento Alimentar Líquido de Própolis, Alho, Tras-resveratrol, Vitaminas e Minerais",Suplementos alimentares
Suplemento Alimentar Líquido de Vitamina C Sabor Laranja,Suplementos alimentares
Suplemento Alimentar Líquido de Vitamina D,Suplementos alimentares
Suplemento Alimentar Líquido de Vitaminas D3 e K2 Sabor Laranja,Suplementos alimentares
Suplemento Alimentar Líquido de Vitaminas Sabor Amargo,Suplementos alimentares
Suplemento Alimentar Líquido de Vitaminas Sabor Maracujá,Suplementos alimentares
Suplemento Alimentar Líquido de Vitaminas do Complexo B Sabor Maracujá/Frutas Vermelhas,Suplementos alimentares
Suplemento Alimentar de Aminoácidos em Cápsulas,Suplementos alimentares
Suplemento Alimentar de Coenzima Q10 e Vitamina E em Gotas Sabores Maracujá/Menta/Abacaxi,Suplementos alimentares
Suplemento Alimentar de Colágeno tipo II e Vitaminas em Cápsulas,Suplementos alimentares
Suplemento Alimentar de Cálcio e Vitamina D em Cápsulas,Suplementos alimentares
"Suplemento Alimentar de Cálcio, Magnésio e Vitaminas D e K em Cápsulas",Suplementos alimentares
"Suplemento Alimentar de Cálcio, Magnésio e Vitaminas K2 e D3 em Cápsulas",Suplementos alimentares
Suplemento Alimentar de Ferro e Vitaminas em Cápsulas,Suplementos alimentares
Suplemento Alimentar de Lisina em Cápsulas,Suplementos alimentares
Suplemento Alimentar de Magnésio e L-Treonina em Cápsulas,Suplementos alimentares
Suplemento Alimentar de Magnésio e Vitaminas D e K em Cápsulas,Suplementos alimentares
Suplemento Alimentar de Melatonina Sabor Frutas Vermelhas/Maracujá/Menta,Suplementos alimentares
"Suplemento Alimentar de Melatonina, Triptofano e Vitamina B6 em Cápsulas",Suplementos alimentares
Suplemento Alimentar de Triptofano e Vitamina B6 em Cápsulas,Suplementos alimentares
Suplemento Alimentar de Vitamina B12 em Cápsulas,Suplementos alimentares
Suplemento Alimentar de Vitamina K2 em Cápsulas,Suplementos alimentares
Suplemento Alimentar de Vitaminas do Complexo B em Cápsulas,Suplementos alimentares
Suplemento Alimentar de Zinco em Cápsulas,Suplementos alimentares
Suplemento Alimentar em Cápsula dura,Suplementos alimentares
Suplemento Alimentar em Pó Sabor Cappuccino,Suplementos alimentares
Suplemento Alimentar em Pó Sabor Frutas Vermelhas/Limão Siciliano/Abacaxi com Hortelã/Laranja,Suplementos alimentares
Suplemento Alimentar em Pó Sabor Guaraná com Açaí,Suplementos alimentares
Suplemento Alimentar em Pó Sabor Laranja,Suplementos alimentares
Suplemento Alimentar em Pó Sabor Laranja/Limão,Suplementos alimentares
Suplemento Alimentar em Pó Sabor Laranja/Limão/Pink Lemonade,Suplementos alimentares
Suplemento Alimentar em Pó Sabor Pink Lemonade,Suplementos alimentares
Suplemento Alimentar em Pó Sabores Laranja/Limão/Limão Siciliano/Pink Limonade,Suplementos alimentares
Suplemento Alimentar em Pó de Magnésio e Inositol,Suplementos alimentares
Suplementos Alimentar em Pó Sabor Laranja/Limão,Suplementos alimentares
MEGA MULTIVITAMIN GUMMY,Suplementos alimentares
SUPLEMENTO ALIMENTAR DE MAGNÉSIO E MELATONINA EM PASTILHAS GOMOSAS,Suplementos alimentares
SUPLEMENTO ALIMENTAR DE PRÓPOLIS EM PASTILHAS GOMOSAS,Suplementos alimentares
FÓRMULA INFANTIL PARA LACTENTES DESTINADA A NECESSIDADES DIETOTERÁPICAS ESPECÍFICAS À BASE DE PROTEÍNA DE SOJA,ALIMENTOS INFANTIS
FÓRMULA INFANTIL PARA LACTENTES DESTINADO A NECESSIDADES DIETOTERÁPICAS ESPECÍFICAS COM RESTRIÇÃO DE LACTOSE À BASE DE PROTEÍNA HIDROLIZADA DE ARROZ,Fórmula infantil destinada a necessidades dietoterápicas específicas
"Suplemento Alimentar à Base de Psyllium, Café Verde, Extrato de Laranja Moro (Citrus sinensis L. Osbeck) e Picolinato de Cromo em pó.",Suplementos alimentares
Suplemento Alimentar de Coenzima Q10 em Cápsula,Suplementos alimentares
Suplemento Alimentar de Inositol em capsulas,Suplementos alimentares
Suplemento Alimentar de Selênio e tabletes,Suplementos alimentares
Suplemento Alimentar em Comprimidos a Base de L-Lisina,Suplementos alimentares
Suplemento Alimentar em Cápsulas a Base de L-Tirosina,Suplementos alimentares
Suplemento Alimentar em Cápsulas a Base de Vitamina K2,Suplementos alimentares
VITAMINA D3 2000 EM CAPSULAS SOFTGEL,Suplementos alimentares
SUPLEMENTO ALIMENTAR DE CLORETO DE MAGNÉSIO LÍQUIDO,Suplementos alimentares
"SUPLEMENTO ALIMENTAR DE COLINA, VITAMINA B6 E B12 LÍQUIDO",Suplementos alimentares
SUPLEMENTO ALIMENTAR DE COLÁGENO E CURCUMINA LÍQUIDO,Suplementos alimentares
SUPLEMENTO ALIMENTAR DE CREATINA MONOHIDRATADA EM PÓ,Suplementos alimentares
SUPLEMENTO ALIMENTAR DE MELATONINA LÍQUIDO,Suplementos alimentares
SUPLEMENTO ALIMENTAR DE PICOLINATO DE CROMO,Suplementos alimentares
SUPLEMENTO ALIMENTAR DE PRÓPOLIS VERDE,Suplementos alimentares
SUPLEMENTO ALIMENTAR DE VITAMINA B12 EM CÁPSULA SOFTGEL,Suplementos alimentares
SUPLEMENTO ALIMENTAR DE VITAMINA E,Suplementos alimentares
SUPLEMENTO ALIMENTAR DE ZINCO LÍQUIDO,Suplementos alimentares
SUPLEMENTO ALIMENTAR EM CAPSULAS DE FERRO QUELATO,Suplementos alimentares
SUPLEMENTO ALIMENTAR EM CÁPSULAS - POLIVITAMÍNICO AZ,Suplementos alimentares
SUPLEMENTO ALIMENTAR EM CÁPSULAS FENOGREGO + ASSOCIAÇÕES,Suplementos alimentares
"SUPLEMENTO ALIMENTAR EM CÁPSULAS ULTRA T2 - COLÁGENO, MAGNÉSIO E VITAMINA D",Suplementos alimentares
SUPLEMENTO ALIMENTAR LÍQUIDO COM ACETILCISTEÍNA,Suplementos alimentares
SUPLEMENTO ALIMENTAR LÍQUIDO DE BIOTINA,Suplementos alimentares
SUPLEMENTO ALIMENTAR LÍQUIDO DE ZINCO,Suplementos alimentares
Suplemento Alimentar Líquido de Vitamina D3+K2,Suplementos alimentares
"Suplemento Alimentar de Coenzima Q10, Vitamina C e Vitamina E",Suplementos alimentares
Suplementos alimentares,Suplementos alimentares
suplemento alimentar em pó,Suplementos alimentares
SUPLEMENTO ALIMENTAR COM ÓLEO DE PEIXE EM CÁPSULAS,Suplementos alimentares
SUPLEMENTO ALIMENTAR COM ÓLEO DE PEIXE EM CÁPSULAS GELATIONOSAS MOLES,Suplementos alimentares
SUPLEMENTO ALIMENTAR COM ÓLEO DE PEIXE EM CÁPSULAS MASTIGÁVEIS,Suplementos alimentares
SUPLEMENTO ALIMENTAR DE VITAMINA D EM CÁPSULAS GELATINOSAS MOLES,Suplementos alimentares
SUPLEMENTO ALIMENTAR DE ÔMEGA 3 EM CÁPSULAS GELATINOSAS MOLES,Suplementos alimentares
SUPLEMENTO ALIMENTAR EM CÁPSULAS COM CÁLCIO e VITAMINA D,Suplementos alimentares
TERMOGÊNICO,Suplementos alimentares
SUPLEMENTO ALIMENTAR DE CÁLCIO E VITAMINA D EM GRÂNULOS EFERVESCENTES,Suplementos alimentares
"Suplemento Alimentar com Vitamina C, Cromo e Cafeína em cápsulas",Suplementos alimentares
Suplemento Alimentar de Cromo em cápsulas,Suplementos alimentares
Suplemento Alimentar de Extrato de Curcuma longa em cápsulas,Suplementos alimentares
Suplemento Alimentar de L-Metionina com Vitaminas em cápsulas,Suplementos alimentares
Suplemento Alimentar de Melatonina e L-Tiptofano em cápsulas,Suplementos alimentares
Suplemento Alimentar de Melatonina líquida Sabor Maracujá,Suplementos alimentares
"Suplemento Alimentar de Quitosana com Espirulina, Psyllium e Cálcio em cápsulas",Suplementos alimentares
Suplemento Alimentar de Vitaminas e Minerais com Ácido Hialurônico em cápsulas,Suplementos alimentares
ENZIMA QUIMOSINA DE BOS TAURUS EXPRESSA EM TRICHODERMA REESEI,COADJUVANTES DE TECNOLOGIA
ENZIMA SUBTILISINA DE BACILLUS CLAUSII EXPRESSO EM BACILLUS SUBTILIS,NOVOS ALIMENTOS E NOVOS INGREDIENTES
LACTOBACILLUS RHAMNOSUS OU LACTICASEIBACILLUS RHAMNOSUS (ATCC 53103),ALIMENTOS C/ALEGAÇOES DE PROPRIEDADES FUNCIONAL E OU DE SAUDE
SUPLEMENTO ALIMENTAR DE BIFIDOBACTERIUM ANIMALIS SUBSP. LACTIS HN019 EM CÁPSULAS,Suplementos Alimentares Contendo Probióticos e/ou Enzimas
"SUPLEMENTO ALIMENTAR DE PROBIÓTICOS BIFIDOBACTERIUM LACTIS BI-07, LACTOBACILLUS ACIDOPHILUS NCFM, BIFIDOBACTERIUM LACTIS BI-04, LACTICASEIBACILLUS PARACASEI LPC-37 E BIFIDOBACTERIUM ANIMALIS SUBSP. LACTIS HN019 EM CÁPSULAS",Suplementos alimentares
DIHIDROCAPSIATO (DHC) SINTÉTICO,NOVOS ALIMENTOS E NOVOS INGREDIENTES
"Suplemento Alimentar em Pó de Aminoácidos, Vitaminas e Mineral",Suplementos alimentares
AMINOPEPTIDASE de Aspergillus oryzae expressa em Aspergillus oryzae,COADJUVANTES DE TECNOLOGIA
L-Glutamina,Suplementos alimentares
"SUPLEMENTO ALIMENTAR A BASE DE BETA ALANINA, ARGININA, TAURINA, TIROSINA E CAFEÍNA",Suplementos alimentares
SUPLEMENTO ALIMENTAR DE CREATINA EM CÁPSULA,Suplementos alimentares
SUPLEMENTO ALIMENTAR EM CÁPSULA A BASE DE COLÁGENO TIPO II E MSM,Suplementos alimentares
SUPLEMENTO ALIMENTAR EM PO A BASE DE MALTODEXTRINA E VITAMINA C,Suplementos alimentares
Suplemento Alimentar em Pó a Base de Proteína do leite e Colágeno hidrolisado,Suplementos alimentares
Suplemento alimentar líquido sabor café expresso,Suplementos alimentares
HIDROXIMETILBUTIRATO DE CÁLCIO EM GRÂNULOS,NOVOS ALIMENTOS E NOVOS INGREDIENTES
OLEO EXTRAÍDO DAS SEMENTES DE BUGLOSSOIDES ARVENSIS ( L.),EMBALAGENS NOVAS TECNOLOGIAS ( RECICLADAS )
Alimentos de transição para alimentação infantil,Alimentos de transição para alimentação infantil
Suplemento Alimentar em Comprimido Mastigável,Suplementos alimentares
Suplemento Alimentar em Comprimido Orodispersível,Suplementos alimentares
Suplemento alimentar em Pó,Suplementos alimentares
ÓLEO DE PEIXE,NOVOS ALIMENTOS E NOVOS INGREDIENTES
SUPLEMENTO ALIMENTAR DE NAC N-ACETIL L-CISTEÍNA EM CAPSULAS VEGANAS,Suplementos alimentares
SUPLEMENTO ALIMENTAR DE OMEGA 3 EM CAPSULA GELATINOSA,Suplementos alimentares
SUPLEMENTO ALIMENTAR EM COMPRIMIDOS À BASE DE MALATO DE MAGNÉSIO,Suplementos alimentares
SUPLEMENTO ALIMENTAR DE ESPIRULINA E VITAMINA C EM COMPRIMIDOS,Suplementos alimentares
SUPLEMENTO ALIMENTAR DE ESPIRULINA E VITAMINA C EM CÁPSULAS,Suplementos alimentares
SUPLEMENTO ALIMENTAR DE ESPIRULINA EM COMPRIMIDOS,Suplementos alimentares
SUPLEMENTO ALIMENTAR DE ESPIRULINA EM CÁPSULA,Suplementos alimentares
SUPLEMENTO ALIMENTAR DE ESPIRULINA EM GRANULADO,Suplementos alimentares
SUPLEMENTO ALIMENTAR DE ESPIRULINA EM PÓ,Suplementos alimentares
SUPLEMENTO ALIMENTAR EM CÁPSULA COM PROBIÓTICOS BB12® e LGG®,Suplementos alimentares
