nomeProduto,categoria
TRIPLA AÇÃO + TRIPTOFANO,Suplementos alimentares
VITAMINA D3 2000UI 50MCG,Suplementos alimentares
WHEY PROTEIN,Suplementos alimentares
ZMA - ZINCO MAGNÉSIO E VITAMINA B6,Suplementos alimentares
ÓLEO DE ABACATE,Suplementos alimentares
ÓLEO DE ABOBORA,Suplementos alimentares
ÓLEO DE ALHO 250 MG,Suplementos alimentares
ÓLEO DE ALHO 500MG,Suplementos alimentares
ÓLEO DE CARTAMO + COCO 1000MG,Suplementos alimentares
ÓLEO DE CHIA 500MG,Suplementos alimentares
ÓLEO DE COCO 1000MG,Suplementos alimentares
ÓLEO DE LINHAÇA + PRIMULA + BORRAGEM,Suplementos alimentares
ÓLEO DE LINHAÇA 1000MG,Suplementos alimentares
ÓLEO DE SEMENTE DE UVA,Suplementos alimentares
Óleo de Prímula capsula softgel,Suplementos alimentares
Óleo de borragem caps soft gel.,Suplementos alimentares
ÔMEGA 3 33/22,Suplementos alimentares
ÔMEGA 3 LIGHT 18/12,Suplementos alimentares
ÔMEGA KIDS,Suplementos alimentares
Ômega 3 18/12 caps soft gel.,Suplementos alimentares
Suplemento Alimentar de Creatina Monoidratada em Pastilhas de Goma,Suplementos alimentares
Suplemento Alimentar de Creatina Monoidratada em Pó,Suplementos alimentares
Suplemento Alimentar de Glutamina em Pó,Suplementos alimentares
Suplemento alimentar em pastilhas de gomas - Colágeno,Suplementos alimentares
Suplemento alimentar em comprimido,Suplementos alimentares
Suplemento alimentar em comprimidos.,Suplementos alimentares
Suplemento alimentar em cápsula mole,Suplementos alimentares
"Suplemento alimentar em cápsulas gelatinosas contendo ômega-3 (EPA/DHA) e vitamina E. Fonte de ômega-3, fonte e alto teor de vitamina E, que é um antioxidante que auxilia na proteção contra os radicais livres.",Suplementos alimentares
Suplemento alimentar em cápsulas gelatinosas moles.,Suplementos alimentares
Suplemento alimentar em cápsulas gelatinosas.,Suplementos alimentares
Suplemento alimentar em líquido,Suplementos alimentares
Biotina,Suplementos alimentares
Cafeína,Suplementos alimentares
Coenzima Q10,Suplementos alimentares
Condroitina + Glucosamina + MSM,Suplementos alimentares
Creatina,Suplementos alimentares
Cúrcuma (Açafrão da Terra),Suplementos alimentares
Glicina,Suplementos alimentares
Glucomannam com Psyllium,Suplementos alimentares
Maca Peruana Pó 150gr,Suplementos alimentares
Magnésio Dimalato,Suplementos alimentares
Magnésio Treonato,Suplementos alimentares
Melatonina,Suplementos alimentares
NAC N-Acetilcisteina,Suplementos alimentares
Potássio com Vitamina B12,Suplementos alimentares
Quercetina + Vitamina C + Zinco,Suplementos alimentares
Vitamina K2 (Menaquinona 7),Suplementos alimentares
Whey Protein 80% (Proteína Isolada de Soja 80% + Whey Protein Concentrado 80%),Suplementos alimentares
Whey Protein de Ervilha,Suplementos alimentares
Zinco Quelato,Suplementos alimentares
NAC EM CÁPSULAS,Suplementos alimentares
Suplemento Alimentar de Creatina em Pó,Suplementos alimentares
Suplemento alimentar de proteína do soro do leite (Whey protein concentrado) em pó,Suplementos alimentares
ARTIGO PRECURSOR LÂMINA DE PET PCR GRAU ALIMENTÍCIO,EMBALAGENS NOVAS TECNOLOGIAS ( RECICLADAS )
MÓDULO DE CARBOIDRATO PARA NUTRIÇÃO ENTERAL ORAL,ALIMENTOS PARA NUTRIÇÃO ENTERAL
MÓDULO DE PROTEINA PARA NUTRIÇÃO ENTERAL E ORAL,ALIMENTOS PARA NUTRIÇÃO ENTERAL
MÓDULO DE PROTEÍNA PARA NUTRIÇÃO ENTERAL  E ORAL,ALIMENTOS PARA NUTRIÇÃO ENTERAL
SUPLEMENTO ALIMENTAR DE PROTEÍNA ISOLADA E HIDROLISADA EM PÓ,Suplementos alimentares
SUPLEMENTO ALIMENTAR DE ÓLEO DE KRILL EM CÁPSULAS,Suplementos alimentares
Suplemento Alimentar de Extrato de Própolis,Suplementos alimentares
Suplemento Alimentar de Extrato de Própolis e Vitamina E em cápsulas,Suplementos alimentares
Suplemento Alimentar de Extrato de Própolis em cápsulas,Suplementos alimentares
Suplemento Alimentar de Magnésio e Vitaminas B5 e B6 em cápsulas,Suplementos alimentares
"Suplemento Alimentar de Metilsulfonilmetano, Curcumina e Vitamina C em cápsulas",Suplementos alimentares
Suplemento Alimentar de Saponinas (Glicosídeos de Furustanol) e Vitamina C em cápsulas,Suplementos alimentares
Suplemento Alimentar de Vitamina D em cápsulas.,Suplementos alimentares
SUPLEMENTO ALIMENTAR DE CREATINA EM PO,Suplementos alimentares
SUPLEMENTO ALIMENTAR DE CÁLCIO E VITAMINA D EM COMPRIMIDO.,Suplementos alimentares
SUPLEMENTO ALIMENTAR EM CAPSULAS DE CREATINA,Suplementos alimentares
SUPLEMENTO ALIMENTAR EM COMPRIMIDO DE CÁLCIO,Suplementos alimentares
SUPLEMENTO ALIMENTAR EM CÁPSULA DE ACETILCISTEÍNA,Suplementos alimentares
SUPLEMENTO ALIMENTAR EM CÁPSULA DE CAFEÍNA,Suplementos alimentares
SUPLEMENTO ALIMENTAR EM CÁPSULA DE COENZIMA Q10,Suplementos alimentares
SUPLEMENTO ALIMENTAR EM CÁPSULA DE CURCUMINA,Suplementos alimentares
SUPLEMENTO ALIMENTAR EM CÁPSULA DE HIDROXIMETILBUTIRATO,Suplementos alimentares
SUPLEMENTO ALIMENTAR EM CÁPSULA DE MELATONINA,Suplementos alimentares
SUPLEMENTO ALIMENTAR EM CÁPSULA DE PICOLINATO DE CROMO,Suplementos alimentares
SUPLEMENTO ALIMENTAR EM CÁPSULA DE VITAMINA D,Suplementos alimentares
SUPLEMENTO ALIMENTAR EM CÁPSULA DE ÁCIDO FÓLICO,Suplementos alimentares
"SUPLEMENTO ALIMENTAR EM CÁPSULAS DE CAFEÍNA, CROMO E ARGININA",Suplementos alimentares
SUPLEMENTO ALIMENTAR EM CÁPSULAS DE COLÁGENO TIPO 2,Suplementos alimentares
SUPLEMENTO ALIMENTAR EM CÁPSULAS DE CROMO + CAFEÍNA + TAURINA + L-CARNITINA + COENZIMA Q10 + RESVERATROL + BORO.,Suplementos alimentares
SUPLEMENTO ALIMENTAR EM CÁPSULAS DE L-CARNITINA,Suplementos alimentares
"SUPLEMENTO ALIMENTAR EM CÁPSULAS DE L-TRIPTOFANO, MAGNÉSIO, VITAMINA B6, MELATONINA E ÁCIDO FÓLICO",Suplementos alimentares
SUPLEMENTO ALIMENTAR EM CÁPSULAS DE MAGNÉSIO,Suplementos alimentares
SUPLEMENTO ALIMENTAR EM CÁPSULAS DE MAGNÉSIO + MSM + ÁCIDO HIALURONICO + COLÁGENO TIPO II,Suplementos alimentares
SUPLEMENTO ALIMENTAR EM CÁPSULAS DE MAGNÉSIO - TRIMAGNÉSIO,Suplementos alimentares
SUPLEMENTO ALIMENTAR EM CÁPSULAS DE VITAMINA B12,Suplementos alimentares
SUPLEMENTO ALIMENTAR EM CÁPSULAS DE VITAMINA C,Suplementos alimentares
SUPLEMENTO ALIMENTAR EM CÁPSULAS DE VITAMINA C + ZINCO,Suplementos alimentares
"SUPLEMENTO ALIMENTAR EM CÁPSULAS DE VITAMINAS (B1, B2, B3, B5, B6, B12, D e K) + ZINCO + MAGNÉSIO + CROMO + BORO + ÁCIDO FOLICO",Suplementos alimentares
SUPLEMENTO ALIMENTAR EM CÁPSULAS DE ZINCO,Suplementos alimentares
SUPLEMENTO ALIMENTAR EM GOTAS DE MELATONINA,Suplementos alimentares
SUPLEMENTO ALIMENTAR EM PÓ DE AMINOÁCIDOS,Suplementos alimentares
SUPLEMENTO ALIMENTAR EM PÓ DE AMINOÁCIDOS + MAGNÉSIO + INOSITOL (FORMULA INDUTORA DO SONO),Suplementos alimentares
SUPLEMENTO ALIMENTAR EM PÓ DE AMINOÁCIDOS - PRE TREINO SEM CAFEÍNA,Suplementos alimentares
SUPLEMENTO ALIMENTAR EM PÓ DE BETA-ALANINA,Suplementos alimentares
SUPLEMENTO ALIMENTAR EM PÓ DE CAFEÍNA - CAFÉ SOLÚVEL,Suplementos alimentares
SUPLEMENTO ALIMENTAR EM PÓ DE CAFEÍNA E AMINOÁCIDOS - PRE TREINO,Suplementos alimentares
"SUPLEMENTO ALIMENTAR EM PÓ DE CAFEÍNA, CARNITINA E CROMO",Suplementos alimentares
SUPLEMENTO ALIMENTAR EM PÓ DE CREATINA + COENZIMA Q10 + COLÁGENO,Suplementos alimentares
SUPLEMENTO ALIMENTAR EM PÓ DE CREATINA COM MALTODEXTRINA,Suplementos alimentares
SUPLEMENTO ALIMENTAR EM PÓ DE CROMO - CHÁ SOLÚVEL,Suplementos alimentares
SUPLEMENTO ALIMENTAR EM PÓ DE HMB,Suplementos alimentares
SUPLEMENTO ALIMENTAR EM PÓ DE L-GLUTAMINA,Suplementos alimentares
SUPLEMENTO ALIMENTAR EM PÓ DE MSM + ÁCIDO HIALURONICO + CROMO + SELÊNIO,Suplementos alimentares
SUPLEMENTO ALIMENTAR EM PÓ DE PROTEÍNAS - PROTEÍNA VEGANA,Suplementos alimentares
SUPLEMENTO ALIMENTAR EM PÓ DE PROTEÍNAS - WHEY + COLÁGENO,Suplementos alimentares
SUPLEMENTO ALIMENTAR EM PÓ DE PROTEÍNAS - WHEY PROTEIN CONCENTRADO,Suplementos alimentares
SUPLEMENTO ALIMENTAR EM PÓ DE PROTEÍNAS - WHEY PROTEIN ISOLADO,Suplementos alimentares
SUPLEMENTO ALIMENTAR EM PÓ HIPERCALÓRICO,Suplementos alimentares
SUPLEMENTO ALIMENTAR PROTEICO EM BARRA,Suplementos alimentares
SUPLEMENTO ALIMENTAR PROTEICO EM PÓ - BEEF PROTEIN,Suplementos alimentares
SUPLEMENTO ALIMENTAR PROTEICO EM PÓ - WHEY + COLÁGENO HIDROLISADO + BEEF PROTEIN,Suplementos alimentares
SUPLEMENTO ALIMENTAR PROTEICO EM PÓ - WHEY BLEND DE SOJA,Suplementos alimentares
SUPLEMENTO ALIMENTAR PROTEICO EM PÓ - WHEY PROTEIN CONCENTRADO + MALTODEXTRINA,Suplementos alimentares
SUPLEMENTO ALIMENTAR PROTEICO EM PÓ - WHEY PROTEIN CONCENTRADO E ISOLADO,Suplementos alimentares
SUPLEMENTO ALIMENTAR PROTEINO EM PÓ - PROTEÍNA DE SORO DO LEITE ISOLADA,Suplementos alimentares
SUPLEMENTO ALIMENTAR PROTEÍCO DE VITAMINA D E VITAMINA K EM PÓ,Suplementos alimentares
SUPLEMENTO ALIMENTAR PROTEÍCO EM PÓ,Suplementos alimentares
SUPLEMENTO EM GOTAS DE VITAMINA D + VITAMINA K2,Suplementos alimentares
SUPLEMENTO ALIMENTAR DE LACTASE EM PÓ,Suplementos Alimentares Contendo Probióticos e/ou Enzimas
Suplemento Alimentar de Acetilcisteína em solução oral (20 mg/mL),Suplementos alimentares
Suplemento Alimentar de Acetilcisteína pó para solução,Suplementos alimentares
Suplemento Alimentar de Vitamina C e Arginina em comprimidos efervescentes,Suplementos alimentares
Suplemento Alimentar de Vitamina C e Zinco em comprimido efervescente.,Suplementos alimentares
Suplemento alimentar de Lactobacillus acidophilus NCFM em suspensão gotas,Suplementos alimentares
Suplemento alimentar de Vitamina C em solução gotas (200 mg/mL),Suplementos alimentares
Suplemento alimentar de vitamina C (1G) em comprimido efervescente,Suplementos alimentares
"Suplemento alimentar líquido de cafeína, aminoácidos e coenzima Q10.",Suplementos alimentares
MAGNESIO CITRATO MALATO,NOVOS ALIMENTOS E NOVOS INGREDIENTES
"Suplemento Alimentar de Vitaminas, Minerais, Carnitina, Coenzima Q10 e Licopeno em Cápsulas",Suplementos alimentares
"Suplemento Alimentar em Cápsulas Moles com óleo de alga, vitaminas e minerais",Suplementos alimentares
"Suplemento Alimentar em Cápsulas com Vitamina C, Resveratrol e Cranberry",Suplementos alimentares
Suplemento Alimentar em Cápsulas com Vitaminas e Minerais.,Suplementos alimentares
Suplemento Alimentar à base de vitaminas em comprimidos,Suplementos alimentares
K SUPLEMENTOS,Suplementos alimentares
PAPINHA DE ARROZ,Resina de PET-PCR grau alimentício
SOMENTE TESTE,Suplementos alimentares
SUPLE MAXXXX,Suplementos alimentares
SUPLE MAXXXX,Alimentos de transição para alimentação infantil
TESTE REPLICAÇÃO,Suplementos alimentares
suplemento,Suplementos alimentares
teste ---21-03-25,Suplementos alimentares
teste sgp,Suplementos alimentares
BISCOITO PARA ALIMENTAÇÃO INFANTIL,ALIMENTOS INFANTIS
Suplemento Alimentar de Carboidratos e Eletrólitos,Suplementos alimentares
"Suplemento Alimentar de Carboidratos, Eletrólitos, Taurina e Metionina Líquido",Suplementos alimentares
Suplemento Alimentar de Colina com Vitamina B1 e Vitamina B6 líquido,Suplementos alimentares
Suplemento Alimentar de Colina e Metionina com Vitamina B1 e Vitamina B6 em Suspensão,Suplementos alimentares
Suplemento Alimentar de Magnésio e Inositol com Aminoácidos e Vitaminas Líquido,Suplementos alimentares
Suplemento Alimentar de Magnésio e Inositol com Aminoácidos e Vitaminas em Cápsulas,Suplementos alimentares
"Suplemento Alimentar de Melatonina com Aminoácidos, Vitaminas e Zinco em Cápsulas",Suplementos alimentares
Suplemento Alimentar de Minerais e Vitaminas com Eletrólitos em Pó,Suplementos alimentares
Suplemento Alimentar de Vitaminas do Complexo B,Suplementos alimentares
Suplemento Alimentar de Vitaminas do Complexo B Líquido,Suplementos alimentares
Suplemento Alimentar de Vitaminas do Complexo B com Colina e Magnésio em Cápsulas,Suplementos alimentares
Suplemento Alimentar de Vitaminas e Minerais Hair 8 em cápsula,Suplementos alimentares
Suplemento alimentar de carboidrato em xarope,Suplementos alimentares
BANHA DE AVESTRUZ,NOVOS ALIMENTOS E NOVOS INGREDIENTES
Creatina micronizada Australia,Suplementos alimentares
Vegana Protein Café com Chocolate,Suplementos alimentares
Vegana Protein Chocolate,Suplementos alimentares
Vegana Protein Vanilla com Coco,Suplementos alimentares
"Suplemento Alimentar de Proteínas ,Vitaminas E Minerais Em Pó.",Suplementos alimentares
Suplemento Aliementar de Magnésio em cápsulas,Suplementos alimentares
"Suplemento Alimentar Vitamina D, Magnésio, Zinco e Cromo em cápsulas",Suplementos alimentares
"Suplemento Alimentar com Vitamina C, Cromo e Cafeína em cápsulas.",Suplementos alimentares
Suplemento Alimentar de Acetilcisteína em cápsulas,Suplementos alimentares
Suplemento Alimentar de Aminoácidos e Cafeína em cápsulas,Suplementos alimentares
"Suplemento Alimentar de Coenzima Q10 com Vitamina E, Magnésio e Zinco em cápsulas",Suplementos alimentares
Suplemento Alimentar de Coenzima Q10 e Trans-Resveratrol com Vitaminas em cápsulas,Suplementos alimentares
"Suplemento Alimentar de Extrato de rizoma de Curcuma longa, Extrato de própolis e Extrato de",Suplementos alimentares
Suplemento Alimentar de Extrato de rizomas de Curcuma longa com Vitamina C em cápsulas,Suplementos alimentares
Suplemento Alimentar de Extrato de rizomas de Curcuma longa em cápsulas.,Suplementos alimentares
Suplemento Alimentar de L-Metionina com Vitaminas em cápsulas.,Suplementos alimentares
"Suplemento Alimentar de L-Tirosina, L-Triptofano, com Vitaminas e Minerais em cápsulas",Suplementos alimentares
Suplemento Alimentar de Melatonina e L-Triptofano em cápsulas,Suplementos alimentares
"Suplemento Alimentar de Psyllium, Extrato de alho e Vitamina B12 em cápsulas",Suplementos alimentares
"Suplemento Alimentar de Vitamina C, Cromo e Cafeína em cápsulas",Suplementos alimentares
"Suplemento Alimentar de Vitamina C, Selênio e Coenzima Q10 em cápsulas",Suplementos alimentares
"Suplemento Alimentar de Vitamina C, Zinco, Selênio e Licopeno em cápsulas",Suplementos alimentares
"Suplemento Alimentar de Vitamina D, Vitamina K, Cálcio e Magnésio em cápsulas",Suplementos alimentares
Suplemento Alimentar de Vitamina E em cápsulas,Suplementos alimentares
"Suplemento Alimentar de Vitamina E, Selênio, Zinco, Boro e Licopeno em cápsulas",Suplementos alimentares
"Suplemento Alimentar de Vitaminas C e D, Cálcio e Magnésio em cápsulas",Suplementos alimentares
Suplemento Alimentar de Vitaminas e Minerais com ácido hialurônico em cápsulas,Suplementos alimentares
Suplemento alimentar de Cromo em cápsulas,Suplementos alimentares
PRÉ FORMA DE PET PÓS CONSUMO RECICLADO GRAU ALIMENTICIO MONOCAMADA USO ÚNICO,EMBALAGENS NOVAS TECNOLOGIAS ( RECICLADAS )
PRÉ-FORMA DE PET PÓS CONSUMO RECICLADO GRAU ALIMENTÍCIO MONOCAMADA USO ÚNICO,EMBALAGENS NOVAS TECNOLOGIAS ( RECICLADAS )
PRÉ-FORMA DE PET PÓS-CONSUMO RECICLADO MONOCAMADA USO ÚNICO,EMBALAGENS NOVAS TECNOLOGIAS ( RECICLADAS )
PRÉ-FORMA DE PET-PCR RECICLADO GRAU ALIMENTÍCIO MONOCAMADA USO ÚNICO,EMBALAGENS NOVAS TECNOLOGIAS ( RECICLADAS )
BISGLICINATO DE MAGNÉSIO EM CAPSULAS,Suplementos alimentares
EXTRATO DE RIZOMAS DE CURCUMA LONGA EM CÁPSULAS,Suplementos alimentares
MAG TREO EM CÁPSULAS,Suplementos alimentares
MAG-VIRIL,Suplementos alimentares
MAGNÉSIO DIMALATO EM CAPSULAS,Suplementos alimentares
MacaPlus,Suplementos alimentares
N-ACETIL L-CISTEÍNA,Suplementos alimentares
Peptídeos Bioativos de Colágeno Hidrolisado com peso molecular médio de 2kDa,Suplementos alimentares
Pré-Treino Dino,Suplementos alimentares
SUPLEMENTO ALIMENTAR DE VITAMINA B12 LÍQUIDO & COMPRIMIDO,Suplementos alimentares
SUPLEMENTO ALIMENTAR FENO - GREGO EM CÁPSULAS,Suplementos alimentares
"Suplemento alimentar de vitaminas D3, K2 e E",Suplementos alimentares
TAURATO + INOSITOL (HARMONIA DO CICLO),Suplementos alimentares
VITAMINA B12 (METILCOBALAMINA CÁPSULAS),Suplementos alimentares
Vitamina Complexo B (Gotas),Suplementos alimentares
Fórmula dietoterápica de carboidrato para glicogenose hepática,Fórmula dietoterápica para erros inatos do metabolismo
SUPLEMENTO ALIMENTAR CÁPSULA,Suplementos alimentares
SUPLEMENTO ALIMENTAR DE PROTEÍNA EM BARRA,Suplementos alimentares
SUPLEMENTO ALIMENTAR DE PROTEÍNA EM PÓ,Suplementos alimentares
SUPLEMENTO ALIMENTAR PÓ,Suplementos alimentares
Suplemento Alimentar de Proteína em barra,Suplementos alimentares
Suplemento alimentar em pó de Creatina,Suplementos alimentares
COLÁGENO DE FRANGO TIPO II NÃO DESNATURADO,NOVOS ALIMENTOS E NOVOS INGREDIENTES
"Suplemento Alimentar em Cápsulas de Café Verde, Cromo e Magnésio",Suplementos alimentares
Suplemento Alimentar em Cápsulas de Vitamina D e Cálcio,Suplementos alimentares
"Suplemento Alimentar em Cápsulas à base de Óleo de Peixe, Vitaminas e Minerais",Suplementos alimentares
Suplemento Alimentar em cápsulas de cafeína,Suplementos alimentares
"Suplemento Alimentar em cápsulas de cálcio, magnésio, vitamina D e vitamina K",Suplementos alimentares
"Suplemento Alimentar em cápsulas de vitaminas, zinco e cafeína",Suplementos alimentares
Suplemento Alimentar em cápsulas de Óleo de peixe com vitamina E,Suplementos alimentares
"Suplemento Alimentar em pastilhas de gomas de vitamina C, vitamina D e Zinco",Suplementos alimentares
Suplemento Alimentar em pastilhas de gomas de vitaminas e minerais,Suplementos alimentares
Suplemento alimentar em cápsula de Coenzima Q10 e vitamina E,Suplementos alimentares
Suplemento alimentar em cápsula de colágeno tipo II não desnaturado,Suplementos alimentares
"Suplemento alimentar em cápsula de colágeno tipo II não desnaturado, magnésio, metilsulfonilmetano e vitamina D",Suplementos alimentares
Suplemento alimentar em cápsula de magnésio e vitamina B6,Suplementos alimentares
Suplemento alimentar em cápsula de melatonina,Suplementos alimentares
Suplemento alimentar em cápsula de vitamina B12,Suplementos alimentares
Suplemento alimentar em cápsula de vitamina D,Suplementos alimentares
Suplemento alimentar em cápsula de vitaminas e minerais,Suplementos alimentares
"Suplemento alimentar em cápsula de zinco, magnésio e vitamina B6",Suplementos alimentares
"Suplemento alimentar em cápsula de óleo de alho, vitamina D, selênio e zinco",Suplementos alimentares
Suplemento alimentar em cápsula de óleo de semente de abóbora e licopeno,Suplementos alimentares
Suplemento alimentar em cápsula à base de óleo de alho,Suplementos alimentares
"Suplemento alimentar em cápsulas de Vitamina A, Vitamina E e Cromo",Suplementos alimentares
"Suplemento alimentar em cápsulas de curcumina, aminoácido, vitaminas e minerais",Suplementos alimentares
Suplemento alimentar em pastilha de goma de biotina,Suplementos alimentares
Suplemento alimentar em pastilha de goma de creatina,Suplementos alimentares
Suplemento alimentar em pastilha de goma de melatonina,Suplementos alimentares
Suplemento alimentar em pastilha de goma de vitamina B12 e ácido fólico,Suplementos alimentares
Suplemento alimentar em pastilha de goma de vitamina C,Suplementos alimentares
"Suplemento alimentar em pastilha de goma de vitamina E, zinco e selênio",Suplementos alimentares
"Suplemento alimentar em pastilhas de goma de Vitamina C, Vitamina D e Zinco",Suplementos alimentares
Suplemento alimentar em pastilhas de goma de Vitamina D3,Suplementos alimentares
Suplemento alimentar em pastilhas de gomas de Vitamina C,Suplementos alimentares
suplemento alimentar em pastilha de goma de vitamina B12,Suplementos alimentares
Creatina monoidratada,Suplementos alimentares
SUPOLEMENTO ALIMENTAR EM CÁPSULAS,Suplementos alimentares
Antocianinas,Suplementos alimentares
Beta-alanina,Suplementos alimentares
Coenzima Q10 + Vitamina E em cápsulas,Suplementos alimentares
Coenzima Q10 em cápsulas,Suplementos alimentares
Colágeno tipo II,Suplementos alimentares
D3 + K2,Suplementos alimentares
Magnésio Quelato em cápsulas,Suplementos alimentares
SUPLEMENTO ALIMENTAR DE MAGNÉSIO (3 MAGNÉSIOS),Suplementos alimentares
SUPLEMENTO ALIMENTAR LÍQUIDO DE ARGININA E TAURINA,Suplementos alimentares
SUPLEMENTO ALIMENTAR MULTIVITAMÍNICO EM CÁPSULAS,Suplementos alimentares
Suplemento Alimentar Líquido de Vitamina B12,Suplementos alimentares
Suplemento alimentar de aminoácidos,Suplementos alimentares
Suplemento alimentar em cápsulas 5 magnésios,Suplementos alimentares
Suplemento alimentar em cápsulas Arginina,Suplementos alimentares
Suplemento alimentar em cápsulas Picolinato de Cromo,Suplementos alimentares
Suplemento alimentar em cápsulas de Coenzima Q10 + Triptofano,Suplementos alimentares
Suplemento alimentar em cápsulas de Cúrcuma,Suplementos alimentares
Suplemento alimentar em cápsulas de Tirosina,Suplementos alimentares
Suplemento alimentar em cápsulas de carnitina,Suplementos alimentares
Suplemento alimentar em cápsulas de ácido clorogênico,Suplementos alimentares
"Suplemento alimentar líquido de óleo de prímula , linhaça e borragem com vitamina E",Suplementos alimentares
Suplemento alimentar líquido de óleo de semente de uva com vitamina E,Suplementos alimentares
Taurina em cápsulas,Suplementos alimentares
Vitamina D3 líquida,Suplementos alimentares
SUPLEMENTO ALIMENTAR CREATINA MONOHIDRATADA,Suplementos alimentares
SUPLEMENTO ALIMENTAR DE AMINOÁCIDOS DE CADEIA RAMIFICADA BCAA + VIT B6 4.1.1 EM PÓ,Suplementos alimentares
SUPLEMENTO ALIMENTAR DE CAFEÍNA E CROMO EM CÁPSULAS.,Suplementos alimentares
SUPLEMENTO ALIMENTAR DE FERRO E VITAMINA C EM CÁPSULAS,Suplementos alimentares
SUPLEMENTO ALIMENTAR DE PROTEÍNA DO SORO DE LEITE CONCENTRADO EM PÓ,Suplementos alimentares
SUPLEMENTO ALIMENTAR DE SELÊNIO EM CÁPSULAS,Suplementos alimentares
SUPLEMENTO ALIMENTAR DE VITAMINA D3 E K2 (MK-7) EM CÁPSULAS,Suplementos alimentares
SUPLEMENTO ALIMENTAR DE VITAMINA E EM CÁPSULAS,Suplementos alimentares
SUPLEMENTO ALIMENTAR DE VITAMINA E EM CÁPSULAS 430 MG,Suplementos alimentares
SUPLEMENTO ALIMENTAR DE VITAMINAS DO COMPLEXO B E COLINA EM CÁPSULAS,Suplementos alimentares
SUPLEMENTO ALIMENTAR EM CÁPSULAS L-GLUTAMINA E VITAMINA B6,Suplementos alimentares
"SUPLEMENTO ALIMENTAR EM CÁPSULAS À BASE DE TAURATO DE MAGNÉSIO, DIMAGNÉSIO MALATO E BISGLICINATO DE MAGNÉSIO.",Suplementos alimentares
SUPLEMENTO ALIMENTAR EM CÁPSULAS À BASE DE VITAMINAS E MINERAIS.,Suplementos alimentares
SUPLEMENTO ALIMENTAR EM CÁPSULAS Á BASE DE AMINOÁCIDOS E VITAMINA B6.,Suplementos alimentares
"SUPLEMENTO ALIMENTAR EM CÁPSULAS Á BASE DE AMINOÁCIDOS, MINERAIS, VITAMINAS DO COMPLEXO B e VITAMINA C",Suplementos alimentares
"SUPLEMENTO ALIMENTAR EM CÁPSULAS Á BASE DE BETA-GLUCANA, VITAMINAS E MINERAIS.",Suplementos alimentares
"SUPLEMENTO ALIMENTAR EM CÁPSULAS Á BASE DE COLÁGENO TIPO II NÃO DESNATURADO, VITAMINAS E MINERAIS.",Suplementos alimentares
"SUPLEMENTO ALIMENTAR EM CÁPSULAS Á BASE DE SILÍCIO, VITAMINAS E MINERAIS.",Suplementos alimentares
"SUPLEMENTO ALIMENTAR EM PÓ À BASE DE VITAMINAS, MINERAIS, AMINOÁCIDOS, COENZIMA Q10 E ÓLEO DE COCO (cocos nucífera L.).",Suplementos alimentares
"SUPLEMENTO ALIMENTAR EM PÓ: INULINA, VITAMINA C.",Suplementos alimentares
"SUPLEMENTO ALIMENTAR À BASE DE IODO, SELÊNIO E ZINCO EM CÁPSULAS",Suplementos alimentares
"SUPLEMENTO ALIMENTAR À BASE DE TRIPTOFANO, MELATONINA, B3 E B6 CÁPSULAS",Suplementos alimentares
FÓRMULA INFANTIL DE SEGUIMENTO PARA CRIANÇAS DE PRIMEIRA INFÂNCIA,ALIMENTOS INFANTIS
SUPLEMENTO ALIMENTAR EM COMPRIMIDOS MASTIGÁVEIS (BARIATRIC),Suplementos alimentares
SUPLEMENTO ALIMENTAR EM COMPRIMIDOS MASTIGÁVEIS (SUPRIBARI),Suplementos alimentares
SUPLEMENTO ALIMENTAR EM CÁPSULAS (VITACON MULHER),Suplementos alimentares
SUPLEMENTO ALIMENTAR EM CÁPSULAS CAPSULA DE POLI GESTANTE,Suplementos alimentares
SUPLEMENTO ALIMENTAR EM PÓ (ACETILCISTEINA 600MG),Suplementos alimentares
SUPLEMENTO ALIMENTAR EM PÓ (COLÁGENO VERISOL + ÁCIDO HIALURÔNICO),Suplementos alimentares
SUPLEMENTO ALIMENTAR EM PÓ (VITACON SÊNIOR),Suplementos alimentares
SUPLEMENTO ALIMENTAR EM PÓ - COLÁGENO + ÁCIDO HIALURONICO,Suplementos alimentares
SUPLEMENTO ALIMENTAR EM PÓ - SAL AMARGO,Suplementos alimentares
SUPLEMENTO ALIMENTAR LÍQUIDO (HIDRÓXIDO DE MAGNÉSIA),Suplementos alimentares
SUPLEMENTO ALIMENTAR LÍQUIDO (VITACON D GOTAS),Suplementos alimentares
SUPLEMENTO ALIMENTAR LÍQUIDO (VITACON PEQUETITOS),Suplementos alimentares
SUPLEMENTO ALIMENTAR LÍQUIDO (VITACON ZINC KIDS),Suplementos alimentares
SUPLEMENTO ALIMENTAR LÍQUIDO (VITARADE),Suplementos alimentares
SUPLEMENTO ALIMENTAR LÍQUIDO (VITATOSS XAROPE C/ ACETIL),Suplementos alimentares
SUPLEMENTO ALIMENTAR LÍQUIDO - VITACON C GOTAS,Suplementos alimentares
SUPLEMENTO ALIMENTAR LÍQUIDO - VITACON JUNIOR,Suplementos alimentares
SUPLEMENTOS ALIMENTARES EM PÓ (CREATINA),Suplementos alimentares
Suplemento Alimentar Líquido (Spray de Própolis),Suplementos alimentares
Suplemento Alimentar em Cápsulas (Cabelos e Unhas),Suplementos alimentares
Suplemento Alimentar em Cápsulas (Polivitamínico com Óleo de Peixe (PHYTUS)),Suplementos alimentares
Suplemento Alimentar em Xarope (Lactulose),Suplementos alimentares
Suplemento alimentar em comprimidos (Ósseofor),Suplementos alimentares
Suplemento alimentar em comprimidos efervescentes,Suplementos alimentares
Suplemento alimentar em comprimidos efervescentes (Vitamina C + Arginina),Suplementos alimentares
Suplemento alimentar em comprimidos efervescentes (vitamina C + Zinco),Suplementos alimentares
Suplemento alimentar em comprimidos efervescentes (vitamina C + Zn + D),Suplementos alimentares
Suplemento alimentar em comprimidos orodispersíveis (Melatonina),Suplementos alimentares
Suplemento alimentar em comprimidos orodispersíveis (Vitacon orodispersível D + K2MK7),Suplementos alimentares
Suplemento alimentar em cápsula (FORCE HAIR),Suplementos alimentares
Suplemento alimentar em cápsulas (Calciocon MDK),Suplementos alimentares
Suplemento alimentar em cápsulas (Coenzima Q10),Suplementos alimentares
Suplemento alimentar em cápsulas (Complexo B),Suplementos alimentares
Suplemento alimentar em cápsulas (Cálcio + Vitamina D3),Suplementos alimentares
