nomeProduto,categoria
SUPLEMENTO ALIMENTAR EM CÁPSULAS,Suplementos alimentares
Papinha de Fruta Orgânica Banana,Alimentos de transição para alimentação infantil
Papinha de Fruta Orgânica Framboesa e Maça,Alimentos de transição para alimentação infantil
Papinha de Fruta Orgânica Manga e Maça,Alimentos de transição para alimentação infantil
Papinha de Fruta Orgânica Maça,Alimentos de transição para alimentação infantil
Papinha de Fruta Orgânica Morango e Banana,Alimentos de transição para alimentação infantil
Pó para o preparo de bebida para controle de peso,Alimentos para controle de peso
Pó para o preparo de sopa para controle de peso,Alimentos para controle de peso
"SUPLEMENTO ALIMENTAR DE MEMBRANA DE CASCA DE OVO, VITAMINA C, D, K E CÁLCIO EM PÓ",Suplementos alimentares
Suplemento alimentar de cafeína e vitaminas em pó,Suplementos alimentares
"Suplemento alimentar de carboidratos, eletrólitos e vitaminas em pó",Suplementos alimentares
Suplemento alimentar de creatina em pó,Suplementos alimentares
Suplemento alimentar de curcumina em pó,Suplementos alimentares
"Suplemento alimentar de cálcio, magnésio e vitamina D em tabletes",Suplementos alimentares
Suplemento alimentar de fibras líquido,Suplementos alimentares
"Suplemento alimentar de fibras, vitamina C e minerais líquido",Suplementos alimentares
Suplemento alimentar de proteínas em barra,Suplementos alimentares
Suplemento alimentar de proteínas em pó,Suplementos alimentares
"Suplemento alimentar de proteínas, vitaminas e minerais em pó",Suplementos alimentares
Suplemento alimentar de óleo de peixe em cápsulas,Suplementos alimentares
Suplemento alimentar em cápsula,Suplementos alimentares
Suplemento alimentar em pó,Suplementos alimentares
SUPLEMENTO ALIMENTAR DE COENZIMA Q10 EM CÁPSULAS,Suplementos alimentares
SUPLEMENTO ALIMENTAR DE MAGNÉSIO MALATO 350MG,Suplementos alimentares
SUPLEMENTO ALIMENTAR DE VITAMINA K2 EM CÁPSULAS,Suplementos alimentares
SUPLEMENTO DE VITAMINA D EM CÁPSULAS,Suplementos alimentares
Suplemento Alimentar de Óleo de Alho em cápsulas.,Suplementos alimentares
Suplemento Alimentar de Óleo de Peixe em cápsulas,Suplementos alimentares
Suplemento alimentar de vitamina E 400 UI,Suplementos alimentares
Suplemento alimentar de Óleo de Peixe em cápsulas,Suplementos alimentares
EMBALAGEM DE PET-PCR GRAU ALIMENTÍCIO MONOCAMADA DE USO ÚNICO,Artigo precursor ou embalagem final de PET-PCR grau alimentício
PREFORMA OU GARRAFA TRICAMADA PET PCR,EMBALAGENS NOVAS TECNOLOGIAS ( RECICLADAS )
PRÉ-FORMA DE PET-PCR GRAU ALIMENTÍCIO MONOCAMADA DE USO ÚNICO,Artigo precursor ou embalagem final de PET-PCR grau alimentício
PRÉ-FORMA DE PET-PCR GRAU ALIMENTÍCIO MULTICAMADA DE USO ÚNICO,Artigo precursor ou embalagem final de PET-PCR grau alimentício
PRÉ-FORMA PET-PCR GRAU ALIMENTÍCIO DUPLA CAMADA DE USO ÚNICO,EMBALAGENS NOVAS TECNOLOGIAS ( RECICLADAS )
SUPLEMENTO ALIMENTAR EM BARRA,Suplementos alimentares
SUPLEMENTO ALIMENTAR EM GEL,Suplementos alimentares
SUPLEMENTO ALIMENTAR EM PÓ,Suplementos alimentares
SUPLEMENTO ALIMENTAR EM PÓ PARA ATLETAS,Suplementos alimentares
SUPLEMENTO ALIMENTAR EM CÁPSULA MOLE,Suplementos alimentares
SUPLEMENTO ALIMENTAR À BASE DE VITAMINAS E MINERAIS EM CÁPSULA MOLE,Suplementos alimentares
RESINA CRISTAL 100% PET PCR,Resina de PET-PCR grau alimentício
RESINA VERDE 100% PET PCR,Resina de PET-PCR grau alimentício
PRÉ-FORMA DE PET-PCR GRAU ALIMENTÍCIO,EMBALAGENS NOVAS TECNOLOGIAS ( RECICLADAS )
PRÉ-FORMA DE PET-PCR GRAU ALIMENTÍCIO MONOCAMADA USO ÚNICO,EMBALAGENS NOVAS TECNOLOGIAS ( RECICLADAS )
RESINA DE PET-PCR GRAU ALIMENTÍCIO,Resina de PET-PCR grau alimentício
"Suplemento Alimentar de EPA, DHA e Vitamina E em Cápsula",Suplementos alimentares
"Vital D3 + K2 Suplemento Alimentar de Vitaminas E, A, K e D em Cápsulas",Suplementos alimentares
Vital Pro - Suplemento Alimentar de Óleo de Semente de Abóbora e Vitamina E em cápsulas,Suplementos alimentares
Arginina em cápsula,Suplementos alimentares
Beta-Alanina em pó,Suplementos alimentares
Coenzima Q10 + Triptofano,Suplementos alimentares
Glutamina em pó,Suplementos alimentares
Joints Glucosamina e Condroitina com Colágeno tipo II,Suplementos alimentares
Magnésio com Treonina,Suplementos alimentares
NAC,Suplementos alimentares
Proteína concentrada zero lactose,Suplementos alimentares
Pré Treino com Cafeína,Suplementos alimentares
Pré treino com fibra de beterraba,Suplementos alimentares
Própolis,Suplementos alimentares
Suplemento Alimentar,Suplementos alimentares
Suplemento alimentar líquido,Suplementos alimentares
Triple Melatonina,Suplementos alimentares
Vitamina K2,Suplementos alimentares
SUPLEMENTO ALIMENTAR DE BACILLUS SUBTILIS HU58 EM SUSPENSÃO,Suplementos alimentares
SUPLEMENTO ALIMENTAR DE BIOTINA EM COMPRIMIDOS,Suplementos alimentares
SUPLEMENTO ALIMENTAR DE CARBOIDRATOS E ELETRÓLITOS EM PÓ,Suplementos alimentares
SUPLEMENTO ALIMENTAR DE ELETRÓLITOS LÍQUIDO,Suplementos alimentares
SUPLEMENTO ALIMENTAR DE PSYLLIUM EM PÓ,Suplementos alimentares
SUPLEMENTO ALIMENTAR EM COMPRIMIDO,Suplementos alimentares
SUPLEMENTO ALIMENTAR EM COMPRIMIDOS,Suplementos alimentares
SUPLEMENTO ALIMENTAR EM SOLUÇÃO,Suplementos alimentares
SUPLEMENTO ALIMENTAR EM SOLUÇÃO GOTAS,Suplementos alimentares
SUPLEMENTO ALIMENTAR EM SUSPENSÃO GOTAS,Suplementos alimentares
SUPLEMENTO ALIMENTAR EM XAROPE,Suplementos alimentares
SUPLEMENTO ALIMENTAR DE BETA-ALANINA EM PÓ,Suplementos alimentares
"SUPLEMENTO ALIMENTAR DE BETA-ALANINA, ARGININA, TAURINA, CAFEÍNA, TIROSINA E MINERAIS EM PÓ",Suplementos alimentares
SUPLEMENTO ALIMENTAR DE CAFEÍNA EM CÁPSULAS,Suplementos alimentares
SUPLEMENTO ALIMENTAR DE CREATINA EM PÓ,Suplementos alimentares
SUPLEMENTO ALIMENTAR DE GLUTAMINA EM PÓ,Suplementos alimentares
SUPLEMENTO ALIMENTAR DE VITAMINA C EM CÁPSULAS,Suplementos alimentares
PRÉ-FORMA DE PET PÓS-CONSUMO RECICLADO GRAU ALIMENTÍCIO MONOCAMADA USO ÚNICO E RETORNÁVEL,EMBALAGENS NOVAS TECNOLOGIAS ( RECICLADAS )
"AZULINHO, ALPHAN, TITANUP",Suplementos alimentares
BIO MAG7,Suplementos alimentares
BIOTINA + EM CÁPSULAS,Suplementos alimentares
COLÁGENO TIPO 2 EM CÁPSULAS,Suplementos alimentares
CURCUMA EM CÁPSULAS,Suplementos alimentares
EXTRA CALCIO MDK2,Suplementos alimentares
FENOMEN (CÁPSULAS),Suplementos alimentares
"LICOX, LICOPENO EM CÁPSULAS.",Suplementos alimentares
MAG 7,Suplementos alimentares
MAGNESIO + INOSITOL EM PÓ,Suplementos alimentares
PSYLLIUM EM CÁPSULAS,Suplementos alimentares
VITAMINA B12,Suplementos alimentares
VITAMINA COMPLEXO B LIQUIDO,Suplementos alimentares
"Sopinha de carne, macarrão e legumes para crianças de primeira infância",Alimentos de transição para alimentação infantil
"Sopinha de carne, mandioquinha e legumes para lactentes e crianças de primeira infância",Alimentos de transição para alimentação infantil
"Sopinha de feijão, carne e legumes para lactentes e crianças de primeira infância",Alimentos de transição para alimentação infantil
"Sopinha de frango, arroz e legumes para lactentes e crianças de primeira infância",Alimentos de transição para alimentação infantil
FÓRMULA DIETOTERÁPICA COM RESTRIÇÃO DOS AMINOÁCIDOS TIROSINA E FENILALANINA,Fórmula dietoterápica para erros inatos do metabolismo
FÓRMULA INFANTIL PARA LACTENTES E DE SEGUIMENTO PARA LACTENTES E CRIANÇAS DE PRIMEIRA INFÂNCIA DESTINADA A NECESSIDADES DIETOTERÁPICAS ESPECÍFICAS COM RESTRIÇÃO DE LACTOSE À BASE DE AMINOÁCIDOS LIVRES,ALIMENTOS INFANTIS
FÓRMULA INFANTIL PARA LACTENTES E DE SEGUIMENTO PARA LACTENTES E/OU CRIANÇAS DE PRIMEIRA INFÂNCIA DESTINADA A NECESSIDADES DIETOTERÁPICAS ESPECÍFICAS COM RESTRIÇÃO DE LACTOSE À BASE DE AMINOÁCIDOS LIVRES,ALIMENTOS INFANTIS
FÓRMULA MODIFICADA PARA NUTRIÇÃO ENTERAL E ORAL,ALIMENTOS PARA NUTRIÇÃO ENTERAL
FÓRMULA PADRÃO PARA NUTRIÇÃO ENTERAL E ORAL,ALIMENTOS PARA NUTRIÇÃO ENTERAL
FÓRMULA PADRÃO PARA NUTRIÇÃO ENTERAL E ORAL,Fórmula padrão para nutrição enteral
FÓRMULA PEDIÁTRICA PARA NUTRIÇÃO ENTERAL E ORAL,ALIMENTOS PARA NUTRIÇÃO ENTERAL
FÓRMULA PEDIÁTRICA PARA NUTRIÇÃO ENTERAL E ORAL,Fórmula pediátrica para nutrição enteral
MÓDULO DE LIPÍDEOS PARA NUTRIÇÃO ENTERAL E ORAL,ALIMENTOS PARA NUTRIÇÃO ENTERAL
GARRAFA PET PÓS CONSUMO RECICLADO GRAU ALIMENTÍCIO MONOCAMADA USO ÚNICO,EMBALAGENS NOVAS TECNOLOGIAS ( RECICLADAS )
GARRAFAS PET CRISTAL 50% PET-PCR,EMBALAGENS NOVAS TECNOLOGIAS ( RECICLADAS )
PRE-FORMA DE PET PCR GRAU ALIMENTÍCIO,EMBALAGENS NOVAS TECNOLOGIAS ( RECICLADAS )
PRÉ-FORMA DE PET-PCR VERDE - GRAU ALIMENTÍCIO,EMBALAGENS NOVAS TECNOLOGIAS ( RECICLADAS )
PRÉ-FORMA DE PET-PCR VERDE GRAU ALIMENTÍCIO,EMBALAGENS NOVAS TECNOLOGIAS ( RECICLADAS )
Suplemento alimentar de carboidratos e eletrólitos,Suplementos alimentares
Suplemento alimentar de eletrólitos,Suplementos alimentares
Suplemento Alimentar de Pastilhas em Gomas,Suplementos alimentares
Suplemento Alimentar em Cápsula Oleosa,Suplementos alimentares
Suplemento Alimentar em Cápsulas,Suplementos alimentares
Suplemento Alimentar em Pastilha de Goma,Suplementos alimentares
PRE-FORMA DE PET PCR GRAU ALIMENTICIO MONOCAMADA USO ÚNICO,EMBALAGENS NOVAS TECNOLOGIAS ( RECICLADAS )
PRÉ-FORMA DE PET PCR GRAU ALIMENTÍCIO MONOCAMADA USO ÚNICO,EMBALAGENS NOVAS TECNOLOGIAS ( RECICLADAS )
CREATINA MONOHIDRATADA 300 G- IT PRO,Suplementos alimentares
Creatina monohidratada 300g -Melfit,Suplementos alimentares
SUPLEMENTO ALIMENTAR EM CAPSULA -BIOTINA 60 CAPSULAS,Suplementos alimentares
SUPLEMENTO ALIMENTAR EM CAPSULA -GUARANA 60 CAPSULAS,Suplementos alimentares
SUPLEMENTO ALIMENTAR EM CAPSULA -POLIVITAMINICO AZ 60 CAPS.,Suplementos alimentares
SUPLEMENTO ALIMENTAR EM CAPSULA-PICOLINATO DE CROMO 60 CAPSULAS,Suplementos alimentares
SUPLEMENTO ALIMENTAR EM CÁPSULA MAGNÉSIO DIMALATO 60 CAPSULAS,Suplementos alimentares
SUPLEMENTO ALIMENTAR EM CÁPSULA  CAFEÍNA 200 mg  60 CÁPSULAS,Suplementos alimentares
SUPLEMENTO ALIMENTAR EM CÁPSULA  CÁLCIO + VITAMINA D 90 CÁPSULAS,Suplementos alimentares
SUPLEMENTO ALIMENTAR EM CÁPSULA  VITAMINA C 1G,Suplementos alimentares
SUPLEMENTO ALIMENTAR EM PO MAGNÉSIO E INOSITOL SABOR MARACUJA,Suplementos alimentares
SUPLEMENTO ALIMENTAR EM PÓ -MAGNESIO DIMALATO 150G,Suplementos alimentares
SUPLEMENTO ALIMENTAR EM PÓ- ACETILCISTEÍNA 600 MG SACHÊ 5G,Suplementos alimentares
Suplemento Alimentar Em Capsula - Complexo B Snp- 60 capsulas,Suplementos alimentares
Suplemento Alimentar Em Capsula - Vitaminas E Colágeno Sp 60 capsulas,Suplementos alimentares
Suplemento Alimentar Em Capsula  Acetilcisteína 600 mg 60 Capsulas,Suplementos alimentares
Suplemento Alimentar Em Capsula  Coenzima Q10 +Vit E- 200 mg- 60 capsulas,Suplementos alimentares
Suplemento Alimentar Em Capsula  Coenzima Q10 60 capsulas.,Suplementos alimentares
Suplemento Alimentar Em Capsula  Laranja Moro e Associação 60 Capsulas,Suplementos alimentares
Suplemento Alimentar Em Capsula  Melatonina 2 -60 Capsulas,Suplementos alimentares
Suplemento Alimentar Em Capsula  Melatonina N Sp. 60 capsulas,Suplementos alimentares
Suplemento Alimentar Em Capsula  Polivitamínico +Beta Glucana Pv 60 Cp,Suplementos alimentares
Suplemento Alimentar Em Capsula  Polivitamínico Antiox Pv 60 Capsulas,Suplementos alimentares
Suplemento Alimentar Em Capsula  Polivitamínico Antocianinas Pv 60 Capsulas,Suplementos alimentares
Suplemento Alimentar Em Capsula  Polivitamínico Complexo B 60 Capsulas,Suplementos alimentares
Suplemento Alimentar Em Capsula  Polivitamínico Gest Pv 60 Cp.,Suplementos alimentares
Suplemento Alimentar Em Capsula  Polivitamínico Mulher Pv 60 capsulas,Suplementos alimentares
Suplemento Alimentar Em Capsula  Polivitamínico e mineral D Sp 60 capsulas,Suplementos alimentares
Suplemento Alimentar Em Capsula  Vitamina B12 60 capsulas,Suplementos alimentares
Suplemento Alimentar Em Capsula  Vitamina D3 60 capsulas,Suplementos alimentares
Suplemento Alimentar Em Pó - Creatina Efervescente Natural 360 G,Suplementos alimentares
Suplemento Alimentar Em Pó - Creatina Efervescente Sabor Limão siciliano 180 G,Suplementos alimentares
Suplemento Alimentar Em Pó - Creatina Efervescente Sabor Maça verde 180 G,Suplementos alimentares
Suplemento Alimentar Em Pó - Creatina Efervescente Sabor Maçã Verde 360 G,Suplementos alimentares
Suplemento Alimentar Em Pó - Creatina Efervescente Sabor Morango 180 G,Suplementos alimentares
Suplemento Alimentar Em Pó - Creatina Efervescente Sabor Uva 180 G,Suplementos alimentares
Suplemento Alimentar Em Pó - Creatina Efervescente Sabor Uva 360 G,Suplementos alimentares
Suplemento Alimentar Em Pó - Creatina Efervescente Tradicional 180 G,Suplementos alimentares
Suplemento Alimentar Em Pó - Creatina Monohidratada 2- 300 G,Suplementos alimentares
Suplemento Alimentar Em Pó - Creatina Monohidratada 300g,Suplementos alimentares
Suplemento Alimentar Em Pó - Creatina Monohidratada Pouch 500 g,Suplementos alimentares
Suplemento Alimentar Em Pó - Creatina Monohidratada Stand Up Pouch 200 Mesh 500g,Suplementos alimentares
Suplemento Alimentar Em Pó - Creatina Natural 360 G,Suplementos alimentares
Suplemento Alimentar Em capsula mastigável  Melatonina sabor maracujá 30 capsulas,Suplementos alimentares
Suplemento Alimentar Em capsula mastigável  Polivitamínico sabor maracujá 30 capsulas,Suplementos alimentares
Suplemento Alimentar Em capsula mastigável  Vitamina b12 sabor morango 30 capsulas,Suplementos alimentares
Suplemento Alimentar Em capsula mastigável  Vitamina d3 sabor laranja 60 capsulas,Suplementos alimentares
Suplemento Alimentar em Cápsula mastigável melatonina sabor maracujá 180 capsulas,Suplementos alimentares
Suplemento alimentar em capsula MSM 90 capsulas,Suplementos alimentares
Suplemento alimentar em capsula Magnesio+ associaçoes 60 capsulas - Pr3,Suplementos alimentares
Suplemento alimentar em cápsula 5 Magnésio 60 cápsulas,Suplementos alimentares
Suplemento alimentar em cápsula coenzima Q10 +VIT E 90 cápsulas,Suplementos alimentares
"SUPLEMENTO ALIMENTAR EM SOLUÇÃO ORAL COM VITAMINAS A, D e E",Suplementos alimentares
Suplemento alimentar em solução oral,Suplementos alimentares
SUPLEMENTO ALIMENTAR DE ELETRÓLITOS EM PÓ,Suplementos alimentares
suplemento alimentar em cápsula,Suplementos alimentares
SUPLEMENTO ALIMENTAR DE LACTASE EM COMPRIMIDOS MASTIGÁVEIS,Suplementos Alimentares Contendo Probióticos e/ou Enzimas
SUPLEMENTO ALIMENTAR DE LACTASE EM CÁPSULAS,Suplementos Alimentares Contendo Probióticos e/ou Enzimas
SUPLEMENTO ALIMENTAR EM COMPRIDOS EFERVESCENTES,Suplementos alimentares
SUPLEMENTO ALIMENTAR EM COMPRIMIDO REVESTIDO,Suplementos alimentares
SUPLEMENTO ALIMENTAR EM COMPRIMIDOS CÁPSULAS,Suplementos alimentares
SUPLEMENTO ALIMENTAR EM COMPRIMIDOS EFERVESCENTES,Suplementos alimentares
SUPLEMENTO ALIMENTAR EM COMPRIMIDOS MASTIGÁVEIS,Suplementos alimentares
SUPLEMENTO ALIMENTAR EM COMPRIMIDOS REVESTIDOS,Suplementos alimentares
SUPLEMENTO ALIMENTAR EM CÁPSULA,Suplementos alimentares
SUPLEMENTO ALIMENTAR EM CÁPSULAS,Suplementos Alimentares Contendo Probióticos e/ou Enzimas
SUPLEMENTO ALIMENTAR EM CÁPSULAS COM LACTOBACILLUS ACIDOPHILUS NCFM,Suplementos Alimentares Contendo Probióticos e/ou Enzimas
SUPLEMENTO ALIMENTAR EM GOTAS,Suplementos alimentares
SUPLEMENTO ALIMENTAR EM PÓ,Suplementos Alimentares Contendo Probióticos e/ou Enzimas
SUPLEMENTO ALIMENTAR EM SOLUÇÃO ORAL,Suplementos alimentares
SUPLEMENTO ALIMENTAR EM SOLUÇÃO SPRAY,Suplementos alimentares
CAFEÍNA,Suplementos alimentares
COLÁGENO TIPO II,Suplementos alimentares
CREATINA,Suplementos alimentares
LARANJA MORO,Suplementos alimentares
AIPO FERMENTADO EM PÓ,NOVOS ALIMENTOS E NOVOS INGREDIENTES
LACTOBACILLUS FERMENTUM CECT5716,ALIMENTOS C/ALEGAÇOES DE PROPRIEDADES FUNCIONAL E OU DE SAUDE
Creatina Gomas,Suplementos alimentares
Creatina Pó,Suplementos alimentares
Suplemento Alimentar em Cápsulas Gelatinosas,Suplementos alimentares
Suplemento alimentar em pastilhas de gomas,Suplementos alimentares
SUPLEMENTO ALIMENTAR EM CAPSULAS,Suplementos alimentares
SUPLEMENTO ALIMENTAR LÍQUIDO,Suplementos alimentares
Suplemento alimentar em comprimidos revestidos,Suplementos alimentares
SUPLEMENTO ALIMENTAR DE MELATONINA EM COMPRIMIDOS MASTIGÁVEIS,Suplementos alimentares
SUPLEMENTO ALIMENTAR DE VITAMINA C EM COMPRIMIDOS,Suplementos alimentares
SUPLEMENTO ALIMENTAR DE VITAMINA C EM COMPRIMIDOS EFERVESCENTES,Suplementos alimentares
SUPLEMENTO ALIMENTAR DE VITAMINAS A E D EM GOTAS,Suplementos alimentares
"SUPLEMENTO ALIMENTAR DE VITAMINAS C, D E ZINCO EM COMPRIMIDOS EFERVESCENTES",Suplementos alimentares
SUPLEMENTO ALIMENTAR DE VITAMINAS EM COMPRIMIDOS,Suplementos alimentares
SUPLEMENTO ALIMENTAR DE ÁCIDO FÓLICO EM GOTAS,Suplementos alimentares
SUPLEMENTO ALIMENTAR LÍQUIDO DE VITAMINAS,Suplementos alimentares
MetilFolin Suplemento Alimentar em comprimidos de L-Metilfolato de cálcio,Suplementos alimentares
SOPINHA DE CARNE COM BRÓCOLIS E VEGETAIS,ALIMENTOS INFANTIS
SOPINHA DE CARNE COM FEIJÃO CARIOCA E VEGETAIS,ALIMENTOS INFANTIS
SOPINHA DE CARNE COM LENTILHA E VEGETAIS,ALIMENTOS INFANTIS
SOPINHA DE CARNE COM MANDIOQUINHA E VEGETAIS,ALIMENTOS INFANTIS
"SOPINHA DE CARNE COM OVO, BATATA DOCE  E VEGETAIS",ALIMENTOS INFANTIS
SOPINHA DE FRANGO COM ABÓBORA CABOTIÁ E VEGETAIS,ALIMENTOS INFANTIS
SOPINHA DE FRANGO COM ABÓBORA MORANGA E VEGETAIS,ALIMENTOS INFANTIS
SOPINHA DE FRANGO COM ERVILHAS E VEGETAIS,ALIMENTOS INFANTIS
SOPINHA DE FRANGO COM FEIJÃO BRANCO E VEGETAIS,ALIMENTOS INFANTIS
SOPINHA DE FRANGO COM GRÃO DE BICO E VEGETAIS,ALIMENTOS INFANTIS
SOPINHA DE FÍGADO COM ABÓBORA E VEGETAIS,ALIMENTOS INFANTIS
SOPINHA DE PEIXE COM FUBÁ E VEGETAIS,ALIMENTOS INFANTIS
COMPOSTOS DE SÓDIO E POTÁSSIO,NOVOS ALIMENTOS E NOVOS INGREDIENTES
SUPLEMENTO ALIMENTAR DE CARBOIDRATOS E ELETRÓLITOS LÍQUIDO,Suplementos alimentares
SUPLEMENTO ALIMENTAR DE CARBOIDRATO E MINERAL LÍQUIDO,Suplementos alimentares
SUPLEMENTO ALIMENTAR EM COMPRIMIDOS MASTIGÁVEIS COM LACTASE DE ASPERGILLUS ORYZAE,Suplementos Alimentares Contendo Probióticos e/ou Enzimas
SUPLEMENTO ALIMENTAR EM CÁPSULAS MOLES,Suplementos alimentares
Suplemento Alimentar Líquido,Suplementos alimentares
Suplemento Alimentar de Beta Alanina em Pó,Suplementos alimentares
Suplemento Alimentar de Creatina em Cápsulas,Suplementos alimentares
Suplemento Alimentar de Vitamina E em Cápsulas,Suplementos alimentares
Suplemento Alimentar em Comprimidos Revestidos,Suplementos alimentares
Suplemento Alimentar em Solução,Suplementos alimentares
Suplemento Alimentar em comprimidos revestidos,Suplementos alimentares
Suplemento Alimentar em cápsulas,Suplementos alimentares
FLAKE DE PET PCR SUPER LAVADO GRAU ALIMENTÍCIO,Resina de PET-PCR grau alimentício
AVEIA EM FLOCOS,ALIMENTOS C/ALEGAÇOES DE PROPRIEDADES FUNCIONAL E OU DE SAUDE
FARELO DE AVEIA,ALIMENTOS C/ALEGAÇOES DE PROPRIEDADES FUNCIONAL E OU DE SAUDE
SUPLEMENTO ALIMENTAR DE PROTEÍNAS EM BARRA,Suplementos alimentares
Suplemento Alimentar de Creatina em pó,Suplementos alimentares
Suplemento Alimentar de Espirulina em pó,Suplementos alimentares
SUPLEMENTO ALIMENTAR DE CLORETO DE MAGNÉSIO EM CÁPSULAS,Suplementos alimentares
SUPLEMENTO ALIMENTAR DE COENZIMA Q10 E VITAMINA E EM CÁPSULAS,Suplementos alimentares
SUPLEMENTO ALIMENTAR DE COLÁGENO TIPO II NÃO DESNATURADO EM CÁPSULAS,Suplementos alimentares
SUPLEMENTO ALIMENTAR DE CROMO EM CÁPSULAS,Suplementos alimentares
"SUPLEMENTO ALIMENTAR DE CÁLCIO, MAGNÉSIO E VITAMINAS D e K EM CÁPSULAS",Suplementos alimentares
SUPLEMENTO ALIMENTAR DE CÚRCUMA COM MAGNÉSIO EM CÁPSULAS,Suplementos alimentares
SUPLEMENTO ALIMENTAR DE GELEIA REAL LIOFILIZADA EM CÁPSULAS,Suplementos alimentares
SUPLEMENTO ALIMENTAR DE MAGNÉSIO E L-TREONINA EM CÁPSULAS,Suplementos alimentares
SUPLEMENTO ALIMENTAR DE MAGNÉSIO EM CÁPSULAS,Suplementos alimentares
SUPLEMENTO ALIMENTAR DE MALATO DE MAGNÉSIO EM CÁPSULAS,Suplementos alimentares
SUPLEMENTO ALIMENTAR DE MELATONINA COM VITAMINA B6 EM CÁPSULAS,Suplementos alimentares
SUPLEMENTO ALIMENTAR DE SILÍCIO EM CÁPSULAS,Suplementos alimentares
SUPLEMENTO ALIMENTAR DE TRANS-RESVERATROL EM CÁPSULAS,Suplementos alimentares
SUPLEMENTO ALIMENTAR DE TRIPTOFANO E VITAMINA B6 EM CÁPSULAS,Suplementos alimentares
SUPLEMENTO ALIMENTAR DE VITAMINA B12 EM CÁPSULAS,Suplementos alimentares
SUPLEMENTO ALIMENTAR DE VITAMINA D EM CÁPSULAS,Suplementos alimentares
SUPLEMENTO ALIMENTAR DE VITAMINA K EM CÁPSULAS,Suplementos alimentares
SUPLEMENTO ALIMENTAR DE VITAMINAS DO COMPLEXO B EM CÁPSULAS,Suplementos alimentares
"SUPLEMENTO ALIMENTAR DE VITAMINAS, MINERAIS E AMINOÁCIDOS EM CÁPSULAS",Suplementos alimentares
SUPLEMENTO ALIMENTAR DE ZINCO EM CÁPSULAS,Suplementos alimentares
SUPLEMENTO ALIMENTAR LÍQUIDO EM GOTAS,Suplementos alimentares
Extrato seco de própolis,Suplementos alimentares
FILME COEXTRUSADO DE PET-PCR GRAU ALIMENTÍCIO MULTICAMADA DE USO ÚNICO,EMBALAGENS NOVAS TECNOLOGIAS ( RECICLADAS )
FILME COEXTRUSADO DE PET-PCR GRAU ALIMENTÍCIO MULTICAMADA USO ÚNICO,EMBALAGENS NOVAS TECNOLOGIAS ( RECICLADAS )
Suplemento Alimentar Proteico de Clara de Ovo Desidratada,Suplementos alimentares
Lactobacillus rhamnosus GG em sachês,Suplementos alimentares
Pastilhas macias de extrato de cúrcuma,Suplementos alimentares
SUPLEMENTO ALIMENTAR DE BACILLUS CLAUSII EM SUSPENSÃO ORAL,Suplementos Alimentares Contendo Probióticos e/ou Enzimas
"Suplemento Alimentar de Bacillus clausii, em grânulos",Suplementos alimentares
Suplemento Alimentar de Lactobacillus rhamnosus GG em cápsulas,Suplementos alimentares
Suplemento Alimentar em suspensão com Zinco e  Bacillus clausii UBBC-07,Suplementos Alimentares Contendo Probióticos e/ou Enzimas
SUPLEMENTO ALIMENTAR EM PASTILHA DE GOMA,Suplementos alimentares
SUPLEMENTO ALIMENTAR DE VITAMINA C e ZINCO EM COMPRIMIDOS EFERVESCENTES,Suplementos alimentares
"SUPLEMENTO ALIMENTAR DE VITAMINA C, D e ZINCO EM COMPRIMIDOS EFERVESCENTES",Suplementos alimentares
SUPLEMENTO ALIMENTAR DE BIOTINA EM PASTILHAS GOMOSAS,Suplementos alimentares
SUPLEMENTO ALIMENTAR DE CRANBERRY EM PASTILHAS GOMOSAS,Suplementos alimentares
SUPLEMENTO ALIMENTAR DE CREATINA EM PASTILHAS GOMOSAS,Suplementos alimentares
SUPLEMENTO ALIMENTAR DE CÁLCIO E VITAMINA D3 EM PASTILHAS GOMOSAS,Suplementos alimentares
SUPLEMENTO ALIMENTAR DE CÚRCUMA EM PASTILHAS GOMOSAS,Suplementos alimentares
SUPLEMENTO ALIMENTAR DE EXTRATO DE CAFÉ VERDE EM PASTILHAS GOMOSAS,Suplementos alimentares
SUPLEMENTO ALIMENTAR DE MAGNÉSIO EM PASTILHAS GOMOSAS,Suplementos alimentares
SUPLEMENTO ALIMENTAR DE MELATONINA EM PASTILHAS GOMOSAS,Suplementos alimentares
SUPLEMENTO ALIMENTAR DE OMEGA 3 EM PASTILHAS GOMOSAS,Suplementos alimentares
SUPLEMENTO ALIMENTAR DE PROPOLIS E VITAMINA C EM PASTILHAS GOMOSAS,Suplementos alimentares
SUPLEMENTO ALIMENTAR DE PRÓPOLIS E VITAMINA C EM PASTILHAS GOMOSAS,Suplementos alimentares
SUPLEMENTO ALIMENTAR DE VITAMINA B12 EM PASTILHAS GOMOSAS,Suplementos alimentares
SUPLEMENTO ALIMENTAR DE VITAMINA B12 EM PLASTILHAS GOMOSAS,Suplementos alimentares
SUPLEMENTO ALIMENTAR DE VITAMINA C E ZINCO EM PASTILHAS GOMOSAS,Suplementos alimentares
SUPLEMENTO ALIMENTAR DE VITAMINA C EM PASTILHAS GOMOSAS,Suplementos alimentares
SUPLEMENTO ALIMENTAR DE VITAMINA D E CÁLCIO EM PASTILHAS GOMOSAS,Suplementos alimentares
SUPLEMENTO ALIMENTAR DE VITAMINA D3 EM PASTILHAS GOMOSAS,Suplementos alimentares
SUPLEMENTO ALIMENTAR DE VITAMINAS E BIOTINA EM PASTILHAS GOMOSAS,Suplementos alimentares
SUPLEMENTO ALIMENTAR DE VITAMINAS E MINERAIS EM PASTILHAS GOMOSAS,Suplementos alimentares
SUPLEMENTO ALIMENTAR DE VITAMINAS EM PASTILHAS GOMOSAS,Suplementos alimentares
"SUPLEMENTO ALIMENTAR DE VITAMINAS, LUTEÍNA E ZEAXANTINA EM PASTILHAS GOMOSAS",Suplementos alimentares
"SUPLEMENTO ALIMENTAR DE VITAMINAS, MINERAIS E COLINA EM PASTILHAS GOMOSAS",Suplementos alimentares
"SUPLEMENTO ALIMENTAR DE VITAMINAS, MINERAL, LUTEÍNA E ZEAXANTINA EM PASTILHAS GOMOSAS",Suplementos alimentares
SUPLEMENTO ALIMENTAR DE ÁCIDO FÓLICO EM PASTILHAS GOMOSAS,Suplementos alimentares
SUPLEMENTO ALIMENTAR VITAMÍNICO E MINERAL EM PASTILHAS GOMOSAS,Suplementos alimentares
"SUPLEMENTO ALIMENTAR VITAMÍNICO, MINERAL E COLINA EM PASTILHAS GOMOSAS",Suplementos alimentares
Suplemento Alimentar em comprimido,Suplementos alimentares
Suplemento Alimentar em comprimidos,Suplementos alimentares
Suplemento Alimentar em cápsula,Suplementos alimentares
Suplemento Alimentar em cápula,Suplementos alimentares
Suplemento Alimentar em pastilhas,Suplementos alimentares
Suplemento Alimentar em pó,Suplementos alimentares
Suplemento Alimentar líquido,Suplementos alimentares
Suplemento alimentar em cápsulas,Suplementos alimentares
Suplemento alimentar de extrato de própolis em cápsulas,Suplementos alimentares
Suplemento alimentar em capsula,Suplementos alimentares
CEREAL A BASE DE ARROZ E AVEIA PARA ALIMENTAÇÃO INFANTIL,ALIMENTOS INFANTIS
"CEREAL A BASE DE TRIGO, ARROZ, MILHO, AVEIA E CEVADA PARA ALIMENTAÇÃO INFANTIL",ALIMENTOS INFANTIS
"CEREAL A BASE DE TRIGO, ARROZ, MILHO, TRITICALE, AVEIA, CEVADA, CENTEIO E QUINOA PARA ALIMENTAÇÃO INFANTIL",ALIMENTOS INFANTIS
"CEREAL PARA ALIMENTAÇÃO INFANTIL À BASE DE ARROZ, MILHO, AVEIA, CEVADA E QUINOA",ALIMENTOS INFANTIS
CEREAL À BASE DE ARROZ PARA ALIMENTAÇÃO INFANTIL,Cereais para alimentação infantil
CEREAL À BASE DE ARROZ PARA ALIMENTAÇÃO INFANTIL COM BANANA E MAÇÃ,ALIMENTOS INFANTIS
CEREAL À BASE DE AVEIA INTEGRAL E ARROZ PARA ALIMENTAÇÃO INFANTIL,ALIMENTOS INFANTIS
CEREAL À BASE DE AVEIA PARA ALIMENTAÇÃO INFANTIL,Cereais para alimentação infantil
CEREAL À BASE DE MILHO PARA ALIMENTAÇÃO INFANTIL,Cereais para alimentação infantil
"PAPINHA DE BANANA, AMEIXA E AVEIA",Alimentos de transição para alimentação infantil
PAPINHA DE MANGA,Alimentos de transição para alimentação infantil
